531;groaning banshee;A terrifying female spirit, warns perhaps of your own death;Grrrrrrrooaannnnnnnnnn..........;531;banshee;;;-1;16;1;0;0;0;-150;18;18;10;25;25;160;160;0;0;40;2;950;2500;5;6;0;0;0;0;0;0;0;1024;0;0;0;0;0;0;0;0;0;0;0;0;0;0;0;0;0;0;0;0;0;0;0;0;7;8;9;15;22;23;28;0;0;0;0;0;0;0;0;0;0;0;0;0;0;0;0;0;0;0;0;0;0;0;0;0;0;579;579;580;580;581;68;68;84;575;576;0;579;18004288;(null);0;0;0;0;0;0;0;0;0;0
532;incorporeal spirit;You look but can barely see a incorporeal spirit, floating towards you.;oh restless existence...;532;spirit;;;-1;14;1;0;0;2;100;16;18;10;25;25;125;125;0;0;0;4;700;1250;4;4;4;0;0;0;0;0;0;1024;0;0;0;0;0;0;0;0;0;0;0;0;0;0;0;0;0;0;0;0;0;0;0;0;3;8;9;13;15;22;23;28;0;0;0;0;0;0;0;0;0;0;0;0;0;0;0;0;0;0;0;0;0;0;0;0;0;577;577;375;0;0;376;0;377;0;0;0;577;18007504;(null);0;0;0;0;0;0;0;0;0;0
533;wailing banshee;You ears are tortured by the horrible shriek of noise of this female spirit.;SCREAM!!!!!!!!!!!;533;banshee;;;-1;17;1;0;0;0;-150;18;18;13;25;25;180;180;0;0;0;2;1000;10000;5;7;0;0;0;0;0;0;0;1024;0;0;0;0;0;0;0;0;0;0;0;0;0;0;0;0;0;0;0;0;0;0;0;0;7;8;9;15;22;23;28;0;0;0;0;0;0;0;0;0;0;0;0;0;0;0;0;0;0;0;0;0;0;0;0;0;0;579;579;580;580;581;581;575;577;578;0;0;579;18010720;(null);0;0;0;0;0;0;0;0;0;0
534;shriek;You have never seen such a tormented soul!;feel the pain I feel...;534;;;;-1;16;1;0;0;0;50;18;18;13;25;25;170;170;0;0;-10;4;800;2000;5;6;2;0;0;0;0;0;0;1024;0;0;0;0;0;0;0;0;0;0;0;0;0;0;0;0;0;0;0;0;0;0;0;0;7;8;9;13;15;22;23;28;0;0;0;0;0;0;0;0;0;0;0;0;0;0;0;0;0;0;0;0;0;0;0;0;0;582;582;582;583;583;584;84;84;84;84;0;582;18013936;(null);0;0;0;0;0;0;0;0;0;0
535;small leprachaun;You see a small man in green, with pointed ears.;it's my pot-o-gold, so leave it be;535;leprachaun;;;-1;5;1;0;0;2;25;12;18;10;14;12;60;60;0;0;50;15;80;0;2;4;2;0;0;0;0;0;0;1024;0;0;0;0;0;0;0;0;0;0;0;0;0;0;0;0;0;0;0;0;0;0;0;0;8;9;13;0;0;0;0;0;0;0;0;0;0;0;0;0;0;0;0;0;0;0;0;0;0;0;0;0;0;0;0;0;0;167;570;167;570;167;570;570;570;570;570;0;570;18017152;(null);0;0;0;0;0;0;0;0;0;0
536;tree sprite;You see a tiny creature, flitting quickly from tree to tree.;next week I'm going back to the enchanted forest to stay;536;sprite;;;-1;4;1;0;0;0;70;12;18;6;12;14;0;0;0;0;0;0;60;8;1;8;0;0;0;0;0;0;0;1024;0;0;0;0;0;0;0;0;0;0;0;0;0;0;0;0;0;0;0;0;0;0;0;0;8;9;0;0;0;0;0;0;0;0;0;0;0;0;0;0;0;0;0;0;0;0;0;0;0;0;0;0;0;0;0;0;0;191;167;167;167;192;190;191;167;191;192;0;167;18020368;(null);0;0;0;0;0;0;0;0;0;0
537;pixie;The tiny pixie flutters about your head and spits in your ear.;I think I will befuddle you with the good stuff.  It'll last for hours!;537;;;;-1;6;1;0;0;3;10;15;18;10;14;13;75;75;20;20;40;14;125;20;2;5;2;0;0;0;0;0;0;1024;0;0;0;0;0;0;0;0;0;0;0;0;0;0;0;0;0;0;0;0;0;0;0;0;8;10;18;0;0;0;0;0;0;0;0;0;0;0;0;0;0;0;0;0;0;0;0;0;0;0;0;0;0;0;0;0;0;167;160;160;160;160;165;165;165;167;163;0;160;18023584;(null);0;0;0;0;0;0;0;0;0;0
538;swordwraith;Of little substance but painfully real, an undead evil spirit advances...;perish, my friend, and join us;538;wraith;;;-1;13;1;0;0;4;-50;18;13;10;15;11;165;165;0;0;-15;7;650;0;2;10;5;0;0;0;0;0;0;1024;0;0;0;0;0;0;0;0;0;0;0;0;0;0;0;0;0;0;0;0;0;0;0;0;8;9;13;15;22;23;28;0;0;0;0;0;0;0;0;0;0;0;0;0;0;0;0;0;0;0;0;0;0;0;0;0;0;291;292;293;294;343;344;345;346;347;586;0;292;18026800;(null);0;0;0;0;0;0;0;0;0;0
539;soul beckoner;It holds out a pointed finger, calling to your soul...;come, there is no need to resist, come my friend;539;beckoner;;;-1;14;1;0;0;3;-250;16;20;22;20;22;185;185;0;0;-20;6;750;1000;2;12;3;0;0;0;0;0;0;1024;0;0;0;0;0;0;0;0;0;0;0;0;0;0;0;0;0;0;0;0;0;0;0;0;3;7;8;9;13;15;22;23;28;0;0;0;0;0;0;0;0;0;0;0;0;0;0;0;0;0;0;0;0;0;0;0;0;485;580;580;581;581;577;0;0;0;0;0;580;18030016;(null);0;0;0;0;0;0;0;0;0;0
540;destitute beggar;He is down and out, as the saying goes.;all I have left is a few keys, can I sell you one?;540;beggar;;;-1;1;1;0;0;1;0;3;3;3;3;3;1;1;0;0;100;20;1;1;1;1;1;0;0;0;0;0;0;1024;0;0;0;0;0;0;0;0;0;0;0;0;0;0;0;0;0;0;0;0;0;0;0;0;1;13;16;37;0;0;0;0;0;0;0;0;0;0;0;0;0;0;0;0;0;0;0;0;0;0;0;0;0;0;0;0;0;530;530;530;530;530;530;530;530;530;530;0;530;18033232;(null);0;0;0;0;0;0;0;0;0;0
541;drunken sailor;He can hardly stand up, and offer you a swig from a bottle of Uland rum.;I haven't been sober since we came to port!  urp!;541;sailor;;;-1;7;1;0;0;2;-5;15;15;15;15;15;90;90;0;0;30;13;200;25;3;4;2;0;0;0;0;0;0;1024;0;0;0;0;0;0;0;0;0;0;0;0;0;0;0;0;0;0;0;0;0;0;0;0;8;10;12;13;0;0;0;0;0;0;0;0;0;0;0;0;0;0;0;0;0;0;0;0;0;0;0;0;0;0;0;0;0;69;69;69;70;75;75;80;80;80;167;0;69;18036448;(null);0;0;0;0;0;0;0;0;0;0
542;poltergeist;It looks very sad, like it could use a companion.;;542;;;;-1;18;1;0;0;0;-40;19;17;13;17;18;210;210;0;0;0;2;1100;4000;6;5;4;0;0;0;0;0;0;1024;0;0;0;0;0;0;0;0;0;0;0;0;0;0;0;0;0;0;0;0;0;0;0;0;2;3;9;13;15;16;22;23;27;31;0;0;0;0;0;0;0;0;0;0;0;0;0;0;0;0;0;0;0;0;0;0;0;589;589;589;589;589;589;589;589;589;590;0;589;18039664;(null);0;0;0;0;0;0;0;0;0;0
543;groundskeeper;You see a burly looking groundskeeper.;what's your problem, I work here!;543;;;;-1;5;1;0;0;2;4;20;10;16;8;13;65;65;0;0;50;15;100;25;3;3;1;0;0;0;0;0;0;1024;0;0;0;0;0;0;0;0;0;0;0;0;0;0;0;0;0;0;0;0;0;0;0;0;8;11;12;13;0;0;0;0;0;0;0;0;0;0;0;0;0;0;0;0;0;0;0;0;0;0;0;0;0;0;0;0;0;591;591;592;592;211;211;196;196;196;196;0;591;18042880;(null);0;0;0;0;0;0;0;0;0;0
544;pirate lookout;You see a tall, healthy, attentive pirate watching out for intruders like you!;Land ahoy!  Ya got any rum, matey?;544;lookout;;;-1;10;1;0;0;0;-10;20;20;20;13;12;130;130;0;0;0;10;375;100;3;6;2;0;0;0;0;0;0;1024;0;0;0;0;0;0;0;0;0;0;0;0;0;0;0;0;0;0;0;0;0;0;0;0;1;8;9;13;0;0;0;0;0;0;0;0;0;0;0;0;0;0;0;0;0;0;0;0;0;0;0;0;0;0;0;0;0;282;449;449;282;387;282;242;213;110;89;0;449;18046096;(null);0;0;0;0;0;0;0;0;0;0
545;lost soul;A fiendish apparition floats around aimlessly.;;545;soul;;;-1;14;1;0;0;0;0;20;20;20;13;13;145;145;0;0;0;7;375;150;5;4;2;0;0;0;0;0;0;1024;0;0;0;0;0;0;0;0;0;0;0;0;0;0;0;0;0;0;0;0;0;0;0;0;3;8;9;15;22;23;28;0;0;0;0;0;0;0;0;0;0;0;0;0;0;0;0;0;0;0;0;0;0;0;0;0;0;594;594;594;594;594;594;0;0;0;0;0;594;18049312;(null);0;0;0;0;0;0;0;0;0;0
546;crypt guardian;The guardian resembles the stale horror of a zombie, but protects the crypt.;you must leave, and let these souls rest;546;guardian;;;-1;12;1;0;0;0;10;20;20;18;12;15;155;155;0;0;-10;8;550;550;6;4;0;0;0;0;0;0;0;1024;0;0;0;0;0;0;0;0;0;0;0;0;0;0;0;0;0;0;0;0;0;0;0;0;1;2;8;9;13;15;22;23;28;0;0;0;0;0;0;0;0;0;0;0;0;0;0;0;0;0;0;0;0;0;0;0;0;596;596;596;596;596;596;0;0;0;0;0;596;18052528;(null);0;0;0;0;0;0;0;0;0;0
547;Theodenes;You see a muscular little gnome, shrunken with age.  He has but one arm.;in my youth I served King Lyanden, and was toasted throughout Mordor.;547;theodenes;;;-1;17;1;0;0;0;100;21;20;21;22;22;230;230;0;0;-32;3;1250;400;4;9;0;0;0;0;0;0;0;1024;0;0;0;0;0;0;0;0;0;0;0;0;0;0;0;0;0;0;0;0;0;0;0;0;1;6;8;9;13;0;0;0;0;0;0;0;0;0;0;0;0;0;0;0;0;0;0;0;0;0;0;0;0;0;0;0;0;158;254;255;255;586;255;254;586;255;158;0;254;18055744;(null);0;0;0;0;0;0;0;0;0;0
548;someone;;speak knowledge and I will enlighten you;548;spirit;poet;dead;-1;1;1;0;0;1;0;3;3;3;3;3;1;1;0;0;100;20;0;0;0;0;0;0;0;0;0;0;0;1024;0;0;0;0;0;0;0;0;0;0;0;0;0;0;0;0;0;0;0;0;0;0;0;0;1;2;6;13;16;24;25;38;0;0;0;0;0;0;0;0;0;0;0;0;0;0;0;0;0;0;0;0;0;0;0;0;0;0;0;0;0;0;0;0;0;0;0;0;0;18058960;(null);0;0;0;0;0;0;0;0;0;0
549;the dracolich;A pile of bones, but oh so much more...;your foolishness amuses me;549;dracolich;;;-1;24;1;0;0;0;-500;25;25;25;10;10;400;400;500;500;-90;-8;4000;60000;9;4;11;0;0;0;0;0;0;1024;0;0;0;0;0;0;0;0;0;0;0;0;0;0;0;0;0;0;0;0;0;0;0;0;6;7;8;9;12;13;16;18;20;21;22;28;29;31;35;36;0;0;0;0;0;0;0;0;0;0;0;0;0;0;0;0;0;610;610;611;611;612;612;613;613;614;614;0;610;18062176;(null);0;0;0;0;0;0;0;0;0;0
550;Onydonn dragon cultist;He exists as servant to the great undead dragons.;submit or die!;550;onydonn;dragon;cultist;-1;10;1;1;0;2;-15;17;17;17;13;13;140;140;0;0;35;8;400;200;2;12;0;0;0;0;0;0;0;1024;0;0;0;0;0;0;0;0;0;0;0;0;0;0;0;0;0;0;0;0;0;0;0;0;7;8;10;11;13;0;0;0;0;0;0;0;0;0;0;0;0;0;0;0;0;0;0;0;0;0;0;0;0;0;0;0;0;618;618;618;618;617;617;617;617;0;0;0;618;18065392;(null);0;0;0;0;0;0;0;0;0;0
551;screeching old harridan;you see a skinny old woman with long fingernails and wild, grey hair.;get out!  It's mine, you hear me?  It's mine!;551;old;harridan;;-1;15;1;0;0;0;-100;20;21;20;20;20;210;210;0;0;-20;5;1000;800;6;5;0;0;0;0;0;0;0;1024;0;0;0;0;0;0;0;0;0;0;0;0;0;0;0;0;0;0;0;0;0;0;0;0;8;9;12;26;27;0;0;0;0;0;0;0;0;0;0;0;0;0;0;0;0;0;0;0;0;0;0;0;0;0;0;0;0;0;0;0;0;0;0;0;0;0;0;0;0;18068608;(null);0;0;0;0;0;0;0;0;0;0
552;viscount ghost;you see a wispy wraith wielding a diamond studded stilleto.;I've waited awhile for you.  Now revenge is sweet!;552;ghost;;;-1;10;1;0;0;2;-50;17;18;17;17;16;130;130;30;30;0;8;375;100;4;5;2;0;0;0;0;0;0;1024;0;0;0;0;0;0;0;0;0;0;0;0;0;0;0;0;0;0;0;0;0;0;0;0;8;9;13;15;18;0;0;0;0;0;0;0;0;0;0;0;0;0;0;0;0;0;0;0;0;0;0;0;0;0;0;0;0;319;319;192;193;95;94;69;70;71;191;0;319;18071824;(null);0;0;0;0;0;0;0;0;0;0
553;viscount shade;You can barely see a smoky wisp in the outline of a tall man.;you took the family jewel!  Death is yours!;553;shade;;;-1;10;1;0;0;0;-100;17;18;17;16;17;135;135;40;40;0;7;400;100;5;4;2;0;0;0;0;0;0;1024;0;0;0;0;0;0;0;0;0;0;0;0;0;0;0;0;0;0;0;0;0;0;0;0;8;9;13;15;18;0;0;0;0;0;0;0;0;0;0;0;0;0;0;0;0;0;0;0;0;0;0;0;0;0;0;0;0;74;74;74;74;0;0;0;0;0;0;0;74;18075040;(null);0;0;0;0;0;0;0;0;0;0
554;the desk clerk;You see a hobbit wearing an orange suit and no shoes.;by the hour?  No, we don't rent rooms like that.  Begone, slime!;554;desk;clerk;;-1;7;1;0;0;0;20;15;16;16;14;14;90;90;0;0;30;13;180;50;3;5;0;0;0;0;0;0;0;1024;0;0;0;0;0;0;0;0;0;0;0;0;0;0;0;0;0;0;0;0;0;0;0;0;6;9;13;0;0;0;0;0;0;0;0;0;0;0;0;0;0;0;0;0;0;0;0;0;0;0;0;0;0;0;0;0;0;616;616;616;616;616;616;616;616;616;616;0;616;18078256;(null);0;0;0;0;0;0;0;0;0;0
555;Tharonwold;Tharonwold is a half-giant with a huge belly and a bigger grin.;I buy my rum direct from the Uland Island distillery.  You like it?;555;tharonwold;;;-1;18;1;0;0;0;0;25;20;22;23;20;250;250;50;50;-40;2;1400;1000;5;6;5;0;0;0;0;0;0;1024;0;0;0;0;0;0;0;0;0;0;0;0;0;0;0;0;0;0;0;0;0;0;0;0;1;6;8;9;13;0;0;0;0;0;0;0;0;0;0;0;0;0;0;0;0;0;0;0;0;0;0;0;0;0;0;0;0;621;223;621;192;621;621;621;213;213;621;0;223;18081472;(null);0;0;0;0;0;0;0;0;0;0
556;dancemaster;The dancemaster wears tight pants, pointed shoes and a smirk.;I think you would dance like a donkey.  Show us, please.;556;;;;-1;7;1;0;0;0;0;13;20;12;15;15;80;80;0;0;30;13;160;50;1;12;2;0;0;0;0;0;0;1024;0;0;0;0;0;0;0;0;0;0;0;0;0;0;0;0;0;0;0;0;0;0;0;0;8;9;13;0;0;0;0;0;0;0;0;0;0;0;0;0;0;0;0;0;0;0;0;0;0;0;0;0;0;0;0;0;0;0;0;0;0;0;0;0;0;0;0;0;0;18084688;(null);0;0;0;0;0;0;0;0;0;0
557;courtier;You see a member of the royal court at the floating city of Darbonne.;hello, I am here as a member of a delegation from Darbonne;557;;;;-1;6;1;0;0;0;0;15;14;14;14;14;70;70;0;0;40;14;130;40;3;4;0;0;0;0;0;0;0;1024;0;0;0;0;0;0;0;0;0;0;0;0;0;0;0;0;0;0;0;0;0;0;0;0;8;9;0;0;0;0;0;0;0;0;0;0;0;0;0;0;0;0;0;0;0;0;0;0;0;0;0;0;0;0;0;0;0;97;97;97;156;156;156;517;617;617;517;0;97;18087904;(null);0;0;0;0;0;0;0;0;0;0
558;Minnie the potion dealer;Minnie, the orcish hag, sell potions and oils from her push cart.;what would you like to purchase, dearie?  Maybe I have it.;558;minnie;dealer;  ;-1;5;1;0;0;0;100;10;10;25;25;10;2000;2000;1000;1000;50;15;100;2000;1;3;0;0;0;0;0;0;0;1024;0;0;0;0;0;0;0;0;0;0;0;0;0;0;0;0;0;0;0;0;0;0;0;0;1;6;12;16;18;22;23;24;37;0;0;0;0;0;0;0;0;0;0;0;0;0;0;0;0;0;0;0;0;0;0;0;0;199;369;284;353;407;529;517;222;370;620;0;369;18091120;(null);0;0;0;0;0;0;0;0;0;0
559;cat;You see Marbella's pet cat, with a charming collar around its neck.;;559;;;;-1;2;1;0;0;1;50;10;20;11;25;24;50;50;0;0;-100;-10;2000;0;3;6;0;0;0;0;0;0;0;1024;0;0;0;0;0;0;0;0;0;0;0;0;0;0;0;0;0;0;0;0;0;0;0;0;2;8;9;12;16;21;22;28;36;0;0;0;0;0;0;0;0;0;0;0;0;0;0;0;0;0;0;0;0;0;0;0;0;0;0;0;0;0;0;0;0;0;0;0;0;18094336;(null);0;0;0;0;0;0;0;0;0;0
560;Kasmier;You see Kasmier, the lord of the sahuagins, guarding the jeweled key.;What is it you want, filthy creature;560;kasmier;;;-1;18;1;0;0;1;-100;16;25;10;16;15;150;150;0;0;0;3;1450;3500;1;10;10;0;0;0;0;0;0;1024;0;0;0;0;0;0;0;0;0;0;0;0;0;0;0;0;0;0;0;0;0;0;0;0;1;6;8;9;11;13;16;22;28;0;0;0;0;0;0;0;0;0;0;0;0;0;0;0;0;0;0;0;0;0;0;0;0;0;0;0;0;0;0;0;0;0;0;0;0;18097552;(null);0;0;0;0;0;0;0;0;0;0
561;apparition;You cannot see it very well, but you are aware of it presense.;use caution below, my friend, as your magical potions will not work there.;561;ghost;spirit;voice;-1;1;1;0;0;0;100;11;11;11;11;11;0;0;300;300;0;0;0;0;0;0;0;0;1024;1024;1024;1024;1024;1024;0;0;0;0;0;0;0;0;5;6;10;11;23;24;25;0;0;0;0;0;0;0;0;0;1;15;18;22;25;27;0;0;0;0;0;0;0;0;0;0;0;0;0;0;0;0;0;0;0;0;0;0;0;0;0;0;0;0;0;0;0;0;0;0;0;0;0;0;0;18100768;(null);0;0;0;0;0;0;0;0;0;0
562;the caretaker;You see an ugly little half-breed between an orc and a gnome.;would you like to buy some sweet smelling soap?   hehehe;562;caretaker;;;-1;12;1;0;0;0;-100;18;18;18;18;18;165;165;50;50;-10;8;600;200;4;6;0;0;0;0;0;0;0;1024;0;0;0;0;0;0;0;0;0;0;0;0;0;0;0;0;0;0;0;0;0;0;0;0;1;6;8;12;13;18;35;36;37;0;0;0;0;0;0;0;0;0;0;0;0;0;0;0;0;0;0;0;0;0;0;0;0;631;631;631;631;631;631;631;631;631;631;0;631;18103984;(null);0;0;0;0;0;0;0;0;0;0
563;bratty kid;You see a kid turning blue in the face as he throws a temper tantrum.;drop dead, you ugly toad;563;kid;;;-1;3;1;0;0;2;0;12;12;12;12;12;40;40;0;0;70;17;35;5;1;7;0;0;0;0;0;0;0;1024;0;0;0;0;0;0;0;0;0;0;0;0;0;0;0;0;0;0;0;0;0;0;0;0;13;0;0;0;0;0;0;0;0;0;0;0;0;0;0;0;0;0;0;0;0;0;0;0;0;0;0;0;0;0;0;0;0;0;0;0;0;0;0;0;0;0;0;0;0;18107200;(null);0;0;0;0;0;0;0;0;0;0
564;dirty urchin;You see a dirty little kid with his hand out.  It's hard to tell his race.;come on, you can afford a couple of gold pieces;564;urchin;;;-1;2;1;0;0;0;0;12;12;10;12;12;18;18;0;0;80;18;15;5;2;3;0;0;0;0;0;0;0;1024;0;0;0;0;0;0;0;0;0;0;0;0;0;0;0;0;0;0;0;0;0;0;0;0;8;9;13;0;0;0;0;0;0;0;0;0;0;0;0;0;0;0;0;0;0;0;0;0;0;0;0;0;0;0;0;0;0;0;0;0;0;0;0;0;0;0;0;0;0;18110416;(null);0;0;0;0;0;0;0;0;0;0
565;nasty little troll;You see a tiny, but nast young troll.;up yours!;565;little;troll;;-1;4;1;0;0;0;-5;13;13;13;13;13;45;45;0;0;60;16;65;25;3;2;2;0;0;0;0;0;0;1024;0;0;0;0;0;0;0;0;0;0;0;0;0;0;0;0;0;0;0;0;0;0;0;0;10;11;12;0;0;0;0;0;0;0;0;0;0;0;0;0;0;0;0;0;0;0;0;0;0;0;0;0;0;0;0;0;0;0;0;0;0;0;0;0;0;0;0;0;0;18113632;(null);0;0;0;0;0;0;0;0;0;0
566;ugly fat kid;Not only is he fat and ugly, but he just wiped his hands on you.;this candy is sticky, huh?;566;ugly;kid;;-1;5;1;0;0;0;0;15;13;13;13;13;60;60;0;0;50;15;100;30;2;4;2;0;0;0;0;0;0;1024;0;0;0;0;0;0;0;0;0;0;0;0;0;0;0;0;0;0;0;0;0;0;0;0;8;9;13;0;0;0;0;0;0;0;0;0;0;0;0;0;0;0;0;0;0;0;0;0;0;0;0;0;0;0;0;0;0;0;0;0;0;0;0;0;0;0;0;0;0;18116848;(null);0;0;0;0;0;0;0;0;0;0
567;sweet little girl;You see a sweet little girl in a starched pinafore.;Will you adopt me, and take me with you?;567;little;girl;;-1;5;1;0;0;0;20;15;13;13;16;10;45;45;60;60;50;15;100;30;3;3;1;0;0;0;0;0;0;1024;0;0;0;0;0;0;0;0;1;0;0;0;0;0;0;0;0;0;0;0;0;0;0;0;12;18;35;0;0;0;0;0;0;0;0;0;0;0;0;0;0;0;0;0;0;0;0;0;0;0;0;0;0;0;0;0;0;0;0;0;0;0;0;0;0;0;0;0;0;18120064;(null);0;0;0;0;0;0;0;0;0;0
568;green knight;he waits silently as you prepare yorself for this test.;I am strong, but if God wants you to join us, you will prevail over me;568;knight;;;-1;4;1;0;0;0;50;13;13;10;10;15;35;35;0;0;75;16;65;20;2;4;0;0;0;0;0;0;0;1024;0;0;0;0;0;0;0;0;0;0;0;0;0;0;0;0;0;0;0;0;0;0;0;0;1;13;41;0;0;0;0;0;0;0;0;0;0;0;0;0;0;0;0;0;0;0;0;0;0;0;0;0;0;0;0;0;0;633;633;633;633;633;633;633;633;633;633;0;633;18123280;(null);0;0;0;0;0;0;0;0;0;0
569;red knight;The red knight waits quietly for you prepare for your test with him.;I will do my best to defeat you, but I wish you well;569;knight;;;-1;5;1;0;0;0;50;14;14;10;10;17;50;50;0;0;55;15;100;30;2;5;0;0;0;0;0;0;0;1024;0;0;0;0;0;0;0;0;0;0;0;0;0;0;0;0;0;0;0;0;0;0;0;0;1;13;41;0;0;0;0;0;0;0;0;0;0;0;0;0;0;0;0;0;0;0;0;0;0;0;0;0;0;0;0;0;0;634;634;634;634;634;634;634;634;634;634;0;634;18126496;(null);0;0;0;0;0;0;0;0;0;0
570;white knight;The white knight is a servant of God, and is here to test you.;If God wishes you to join us, you will defeat me no matter how hard I try;570;knight;;;-1;6;1;0;0;0;50;15;15;11;11;17;65;65;0;0;45;14;140;35;3;4;0;0;0;0;0;0;0;1024;0;0;0;0;0;0;0;0;0;0;0;0;0;0;0;0;0;0;0;0;0;0;0;0;1;13;41;0;0;0;0;0;0;0;0;0;0;0;0;0;0;0;0;0;0;0;0;0;0;0;0;0;0;0;0;0;0;635;635;635;635;635;635;635;635;635;635;0;635;18129712;(null);0;0;0;0;0;0;0;0;0;0
571;green knight;The Green Knight has volunteered to see if you are ready to advance in level.;;571;knight;;;-1;7;1;0;0;0;100;16;16;14;14;16;80;80;0;0;35;13;200;40;2;6;2;0;0;0;0;0;0;1024;0;0;0;0;0;0;0;0;0;0;0;0;0;0;0;0;0;0;0;0;0;0;0;0;1;8;9;13;41;0;0;0;0;0;0;0;0;0;0;0;0;0;0;0;0;0;0;0;0;0;0;0;0;0;0;0;0;360;360;360;360;360;360;360;360;360;360;0;360;18132928;(null);0;0;0;0;0;0;0;0;0;0
572;red knight;The Red Knight will test your worthiness to serve God.;If you are strong and pure, you may join our holy cause;572;knight;;;-1;8;1;0;0;0;100;17;17;14;14;16;100;100;0;0;20;12;250;45;3;5;1;0;0;0;0;0;0;1024;0;0;0;0;0;0;0;0;0;0;0;0;0;0;0;0;0;0;0;0;0;0;0;0;1;8;9;13;41;0;0;0;0;0;0;0;0;0;0;0;0;0;0;0;0;0;0;0;0;0;0;0;0;0;0;0;0;357;357;357;357;357;357;357;357;357;357;0;357;18136144;(null);0;0;0;0;0;0;0;0;0;0
573;white knight;The White Knight has volunteered to test you, to see if you are truly ready.;Be brave, and never flee from evil.  Defend the weak and slay the evil ones.;573;knight;;;-1;9;1;0;0;0;100;19;19;12;15;16;110;110;0;0;10;11;325;50;3;6;0;0;0;0;0;0;0;1024;0;0;0;0;0;0;0;0;0;0;0;0;0;0;0;0;0;0;0;0;0;0;0;0;1;8;9;13;41;0;0;0;0;0;0;0;0;0;0;0;0;0;0;0;0;0;0;0;0;0;0;0;0;0;0;0;0;637;637;637;637;637;637;637;637;637;637;0;637;18139360;(null);0;0;0;0;0;0;0;0;0;0
574;the puppetmaster;He has several puppets dancing below his hands.;would you like to see how well my puppets can imitate real life?;574;puppetmaster;master;;-1;9;1;0;0;0;0;16;20;14;16;14;120;120;0;0;10;11;320;50;2;8;2;0;0;0;0;0;0;1024;0;0;0;0;0;0;0;0;0;0;0;0;0;0;0;0;0;0;0;0;0;0;0;0;1;6;8;9;13;0;0;0;0;0;0;0;0;0;0;0;0;0;0;0;0;0;0;0;0;0;0;0;0;0;0;0;0;0;0;0;0;0;0;0;0;0;0;0;0;18142576;(null);0;0;0;0;0;0;0;0;0;0
575;puppeteer;The puppeteer controls a singing and dancing puppet.;the puppetmaster gets all the fun stuff.;575;;;;-1;7;1;0;0;2;0;15;18;12;16;14;80;80;0;0;30;13;160;40;3;4;2;0;0;0;0;0;0;1024;0;0;0;0;0;0;0;0;0;0;0;0;0;0;0;0;0;0;0;0;0;0;0;0;8;9;13;0;0;0;0;0;0;0;0;0;0;0;0;0;0;0;0;0;0;0;0;0;0;0;0;0;0;0;0;0;0;0;0;0;0;0;0;0;0;0;0;0;0;18145792;(null);0;0;0;0;0;0;0;0;0;0
576;dragon puppet;The small puppet is very realistic looking, and breathes a small flame!;;576;puppet;;;-1;4;1;0;0;0;0;13;13;16;10;12;40;40;10;10;60;16;65;10;2;4;0;0;0;0;0;0;0;1024;0;0;0;0;0;0;0;0;0;0;0;0;0;0;0;0;0;0;0;0;0;0;0;0;9;18;0;0;0;0;0;0;0;0;0;0;0;0;0;0;0;0;0;0;0;0;0;0;0;0;0;0;0;0;0;0;0;0;0;0;0;0;0;0;0;0;0;0;0;18149008;(null);0;0;0;0;0;0;0;0;0;0
577;pirate puppet;The puppet swaggers like a real pirate, and wields a small cutlass.;;577;puppet;;;-1;3;1;0;0;0;0;13;15;10;10;10;30;30;0;0;70;17;35;5;2;3;1;0;0;0;0;0;0;1024;0;0;0;0;0;0;0;0;0;0;0;0;0;0;0;0;0;0;0;0;0;0;0;0;9;13;0;0;0;0;0;0;0;0;0;0;0;0;0;0;0;0;0;0;0;0;0;0;0;0;0;0;0;0;0;0;0;0;0;0;0;0;0;0;0;0;0;0;0;18152224;(null);0;0;0;0;0;0;0;0;0;0
578;werewolf puppet;The puppet looks like its alive, its so realistic.;;578;puppet;;;-1;3;1;0;0;0;0;15;13;10;9;12;30;30;0;0;70;13;35;5;3;2;1;0;0;0;0;0;0;1024;0;0;0;0;0;0;0;0;0;0;0;0;0;0;0;0;0;0;0;0;0;0;0;0;9;13;14;0;0;0;0;0;0;0;0;0;0;0;0;0;0;0;0;0;0;0;0;0;0;0;0;0;0;0;0;0;0;0;0;0;0;0;0;0;0;0;0;0;0;18155440;(null);0;0;0;0;0;0;0;0;0;0
579;pegasus puppet;The puppet is a small, winged horse and looks like it could truly fly.;;579;puppet;;;-1;2;1;0;0;0;0;13;13;10;10;9;20;20;0;0;80;18;15;5;2;3;0;0;0;0;0;0;0;1024;0;0;0;0;0;0;0;0;0;0;0;0;0;0;0;0;0;0;0;0;0;0;0;0;9;0;0;0;0;0;0;0;0;0;0;0;0;0;0;0;0;0;0;0;0;0;0;0;0;0;0;0;0;0;0;0;0;0;0;0;0;0;0;0;0;0;0;0;0;18158656;(null);0;0;0;0;0;0;0;0;0;0
580;druid puppet;The druidian puppet moves so smoothly its hard to believe its not real.;;580;puppet;;;-1;3;1;0;0;0;0;13;15;10;11;11;30;30;0;0;70;17;35;8;2;3;1;0;0;0;0;0;0;1024;0;0;0;0;0;0;0;0;0;0;0;0;0;0;0;0;0;0;0;0;0;0;0;0;9;0;0;0;0;0;0;0;0;0;0;0;0;0;0;0;0;0;0;0;0;0;0;0;0;0;0;0;0;0;0;0;0;0;0;0;0;0;0;0;0;0;0;0;0;18161872;(null);0;0;0;0;0;0;0;0;0;0
581;the snake charmer;The slow rythm of his body movements holds the attention of the snakes.;Do not break my concentration, else anything can happen with my lovelies.;581;snake;charmer;;-1;12;1;0;0;0;0;20;20;14;18;18;160;160;40;40;-10;8;600;200;5;5;0;0;0;0;0;0;0;1024;0;0;0;0;0;0;0;0;0;0;0;0;0;0;0;0;0;0;0;0;0;0;0;0;1;6;8;9;13;18;0;0;0;0;0;0;0;0;0;0;0;0;0;0;0;0;0;0;0;0;0;0;0;0;0;0;0;661;653;661;653;661;543;199;369;199;369;0;653;18165088;(null);0;0;0;0;0;0;0;0;0;0
582;dwarven janitor;He's about the biggest dwarf you've ever seen, but too dumb to be a warrior.;what are you doing in my celler?  Bothering the members of the Society?;582;janitor;;;-1;3;1;0;0;0;0;12;12;10;8;14;30;30;0;0;70;17;35;50;1;4;2;0;0;0;0;0;0;1024;0;0;0;0;0;0;0;0;0;0;0;0;0;0;0;0;0;0;0;0;0;0;0;0;7;8;9;13;0;0;0;0;0;0;0;0;0;0;0;0;0;0;0;0;0;0;0;0;0;0;0;0;0;0;0;0;0;18;18;20;20;21;21;38;38;20;21;0;18;18168304;(null);0;0;0;0;0;0;0;0;0;0
583;tree spider;The tree spider is about as big as your head, and glares at you with 8 eyes.;;583;spider;;;-1;4;1;0;0;0;-20;15;15;15;10;10;45;45;0;0;60;16;60;0;1;8;0;0;0;0;0;0;0;1024;0;0;0;0;0;0;0;0;0;0;0;0;0;0;0;0;0;0;0;0;0;0;0;0;7;10;11;0;0;0;0;0;0;0;0;0;0;0;0;0;0;0;0;0;0;0;0;0;0;0;0;0;0;0;0;0;0;0;0;0;0;0;0;0;0;0;0;0;0;18171520;(null);0;0;0;0;0;0;0;0;0;0
586;large ettercap;The male ettercap has both upper and lower fangs, and is jealous of its mate.;you came for my sweetie?  I kill you!;586;ettercap;;;-1;12;1;0;0;0;-50;22;21;19;15;15;160;160;0;0;-10;8;600;200;4;6;0;0;0;0;0;0;0;1024;0;0;0;0;0;0;0;0;0;0;0;0;0;0;0;0;0;0;0;0;0;0;0;0;7;8;9;13;14;22;29;30;36;0;0;0;0;0;0;0;0;0;0;0;0;0;0;0;0;0;0;0;0;0;0;0;0;0;0;0;0;0;0;0;0;0;0;0;0;18174736;(null);0;0;0;0;0;0;0;0;0;0
587;ettercap;An odd two legged monster closer to spider than human.;flesh!;587;;;;-1;10;1;0;0;0;-50;20;20;17;14;13;135;135;0;0;0;10;400;100;3;6;2;0;0;0;0;0;0;1024;0;0;0;0;0;0;0;0;0;0;0;0;0;0;0;0;0;0;0;0;0;0;0;0;10;11;14;27;36;0;0;0;0;0;0;0;0;0;0;0;0;0;0;0;0;0;0;0;0;0;0;0;0;0;0;0;0;649;649;650;650;650;650;195;196;197;196;0;649;18177952;(null);0;0;0;0;0;0;0;0;0;0
588;the Ettercap Matron;Old and heavy, she moves sluggishly in your direction with outstretched arms.;ahh, my young ones have found fresh food for me;588;ettercap;matron;;-1;21;1;0;0;0;-200;25;20;25;24;25;300;300;100;100;-60;-2;2200;500;8;7;0;0;0;0;0;0;0;1024;0;0;0;0;0;0;0;0;0;0;0;0;0;0;0;0;0;0;0;0;0;0;0;0;1;6;8;9;14;18;22;35;36;0;0;0;0;0;0;0;0;0;0;0;0;0;0;0;0;0;0;0;0;0;0;0;0;0;0;0;0;0;0;0;0;0;0;0;0;18181168;(null);0;0;0;0;0;0;0;0;0;0
589;baby ettercap;The baby also has a pot-belly and long, spindly arms.  Looks a lot like dad.;look, mama, lets eat it!;589;ettercap;;;-1;6;1;0;0;3;-50;15;16;15;10;12;75;75;0;0;40;14;140;20;3;4;0;0;0;0;0;0;0;1024;0;0;0;0;0;0;0;0;0;0;0;0;0;0;0;0;0;0;0;0;0;0;0;0;7;11;12;13;35;0;0;0;0;0;0;0;0;0;0;0;0;0;0;0;0;0;0;0;0;0;0;0;0;0;0;0;0;0;0;0;0;0;0;0;0;0;0;0;0;18184384;(null);0;0;0;0;0;0;0;0;0;0
590;two-headed asp;Both heads of the asp are watching you intently.;ssssss;590;headed;asp;;-1;4;1;0;0;0;0;12;20;8;10;10;30;30;0;0;70;16;60;0;2;4;0;0;0;0;0;0;0;1024;0;0;0;0;0;0;0;0;0;0;0;0;0;0;0;0;0;0;0;0;0;0;0;0;8;9;14;0;0;0;0;0;0;0;0;0;0;0;0;0;0;0;0;0;0;0;0;0;0;0;0;0;0;0;0;0;0;506;506;506;506;506;53;53;53;53;53;0;506;18187600;(null);0;0;0;0;0;0;0;0;0;0
591;acid snake;The coiled white snake spits a stream of acid towards you!;;591;snake;;;-1;5;1;0;0;0;-10;12;22;16;9;9;60;60;0;0;50;15;100;0;3;3;1;0;0;0;0;0;0;1024;0;0;0;0;0;0;0;0;0;0;0;0;0;0;0;0;0;0;0;0;0;0;0;0;8;9;14;29;30;40;0;0;0;0;0;0;0;0;0;0;0;0;0;0;0;0;0;0;0;0;0;0;0;0;0;0;0;0;0;0;0;0;0;0;0;0;0;0;0;18190816;(null);0;0;0;0;0;0;0;0;0;0
592;baby viper;The viper is bright green and deadly, but only as long as your finger.;sss    ssssss;592;viper;;;-1;1;1;0;0;6;-10;11;18;8;9;9;7;7;0;0;100;19;5;0;1;5;0;0;0;0;0;0;0;1024;0;0;0;0;0;0;0;0;0;0;0;0;0;0;0;0;0;0;0;0;0;0;0;0;10;11;14;0;0;0;0;0;0;0;0;0;0;0;0;0;0;0;0;0;0;0;0;0;0;0;0;0;0;0;0;0;0;507;507;507;507;507;0;0;0;0;0;0;507;18194032;(null);0;0;0;0;0;0;0;0;0;0
593;baby viper;The tiny viper has red eyes and bared fangs.;;593;viper;;;-1;2;1;0;0;0;-10;10;20;10;9;9;15;15;0;0;85;18;12;0;1;6;0;0;0;0;0;0;0;1024;0;0;0;0;0;0;0;0;0;0;0;0;0;0;0;0;0;0;0;0;0;0;0;0;7;8;9;14;0;0;0;0;0;0;0;0;0;0;0;0;0;0;0;0;0;0;0;0;0;0;0;0;0;0;0;0;0;53;53;53;53;53;0;0;0;0;0;0;53;18197248;(null);0;0;0;0;0;0;0;0;0;0
594;mugger;The mugger is a half-giant with a mask over his face.  He carries a lead pipe.;shutup, and give me your stuff;594;;;;-1;8;1;0;0;0;-10;22;13;18;12;13;100;100;0;0;20;12;240;250;5;3;3;0;0;0;0;0;0;1024;0;0;0;0;0;0;0;0;0;0;0;0;0;0;0;0;0;0;0;0;0;0;0;0;1;10;11;13;27;0;0;0;0;0;0;0;0;0;0;0;0;0;0;0;0;0;0;0;0;0;0;0;0;0;0;0;0;259;551;652;652;326;327;328;329;330;456;0;551;18200464;(null);0;0;0;0;0;0;0;0;0;0
595;deformed ogre;The ogre is hideously deformed, with a huge mouth and a double row of teeth.;well, you look like one of the soft and tender ones!;595;ogre;;;-1;14;1;0;0;0;-20;22;20;22;14;15;190;190;0;0;-20;6;820;100;4;7;0;0;0;0;0;0;0;1024;0;0;0;0;0;0;0;0;0;0;0;0;0;0;0;0;0;0;0;0;0;0;0;0;7;8;13;16;0;0;0;0;0;0;0;0;0;0;0;0;0;0;0;0;0;0;0;0;0;0;0;0;0;0;0;0;0;659;659;659;659;227;474;223;213;474;227;0;659;18203680;(null);0;0;0;0;0;0;0;0;0;0
596;drunken ghost;You see a spirit filled with spirits.;my shipmates went off and left me. *sob*;596;ghost;;;-1;8;1;0;0;0;-10;15;15;15;15;18;100;100;20;20;20;12;225;50;4;4;2;0;0;0;0;0;0;1024;0;0;0;0;0;0;0;0;1;13;0;0;0;0;0;0;0;0;0;0;0;0;0;0;10;11;12;13;15;18;21;0;0;0;0;0;0;0;0;0;0;0;0;0;0;0;0;0;0;0;0;0;0;0;0;0;0;97;97;119;156;249;280;319;660;660;660;0;97;18206896;(null);0;0;0;0;0;0;0;0;0;0
597;orcish waitress;pretty to some, perhaps, but not to your taste.;purchase a drink?  I have a nice selection.  Some will lift you off your feet;597;waitress;;;-1;7;1;0;0;0;0;15;15;15;15;15;90;90;0;0;30;13;200;100;3;4;2;0;0;0;0;0;0;1024;0;0;0;0;0;0;0;0;0;0;0;0;0;0;0;0;0;0;0;0;0;0;0;0;1;8;9;37;0;0;0;0;0;0;0;0;0;0;0;0;0;0;0;0;0;0;0;0;0;0;0;0;0;0;0;0;0;663;664;665;663;664;665;663;664;665;663;0;664;18210112;(null);0;0;0;0;0;0;0;0;0;0
