ID; name; description; talk; password; key0; key1; key2; fd; level; type; class; race; numwander; alignment; strength; dexterity; constitution; intelligence; piety; hpmax; hpcur; mpmax; mpcur; armor; thaco; experience; gold; ndice; sdice; pdice; special; proficiency0; proficiency1; proficiency2; proficiency3; proficiency4; proficiency5; realm0; realm1; realm2; realm3; realm4; realm5; realm6; realm7; spells0; spells1; spells2; spells3; spells4; spells5; spells6; spells7; spells8; spells9; spells10; spells11; spells12; spells13; spells14; spells15; flags0; flags1; flags2; flags3; flags4; flags5; flags6; flags7; flags8; flags9; flags10; flags11; flags12; flags13; flags14; flags15; quests0; quests1; quests2; quests3; quests4; quests5; quests6; quests7; quests8; quests9; quests10; quests11; quests12; quests13; quests14; quests15; questnum; carry0; carry1; carry2; carry3; carry4; carry5; carry6; carry7; carry8; carry9; rom_num; bank_balance; title; misc_stats0; misc_stats1; misc_stats2; misc_stats3; misc_stats4; clanindex; clanexp; guildtype; guildexp; special1; special2
0;;;;0;;;;-1;0;1;0;0;0;0;0;0;0;0;0;0;0;0;0;0;0;0;0;0;0;0;0;0;0;0;0;0;1024;0;0;0;0;0;0;0;0;0;0;0;0;0;0;0;0;0;0;0;0;0;0;0;0;0;0;0;0;0;0;0;0;0;0;0;0;0;0;0;0;0;0;0;0;0;0;0;0;0;0;0;0;0;0;0;0;0;0;0;0;0;0;0;0;0;0;0;0;0;8580384;(null);0;0;0;0;0;0;0;0;0;0
1;laborer;He's a sweaty looking laborer.;I'm busy, so stay outta my way.;1;;;;-1;1;1;4;0;0;100;13;10;11;10;11;10;10;0;0;90;19;10;5;2;2;1;0;0;0;0;0;0;1024;0;0;0;0;0;0;0;0;0;0;0;0;0;0;0;0;0;0;0;0;0;0;0;0;9;12;13;0;0;0;0;0;0;0;0;0;0;0;0;0;0;0;0;0;0;0;0;0;0;0;0;0;0;0;0;0;0;17;101;10;101;21;3;0;0;0;0;0;101;8583600;(null);0;0;0;0;0;0;0;0;0;0
2;vagrant;He ain't got nothing but himself.;<Hic!> Ya gott summ beer? <Hic!>;2;;;;-1;1;1;0;0;0;30;9;9;11;11;11;7;7;0;0;100;19;6;0;1;4;0;0;0;0;0;0;0;1024;0;0;0;0;0;0;0;0;0;0;0;0;0;0;0;0;0;0;0;0;0;0;0;0;12;13;0;0;0;0;0;0;0;0;0;0;0;0;0;0;0;0;0;0;0;0;0;0;0;0;0;0;0;0;0;0;0;0;4;0;0;0;4;0;0;0;0;0;4;8586816;(null);0;0;0;0;0;0;0;0;0;0
3;scribe;He carries in his hand a bunch of small books and scrolls.;<Yawn> You bore me;3;scribe;;;-1;1;1;0;0;2;50;11;10;11;11;11;10;10;0;0;90;19;10;20;2;2;1;0;0;0;0;0;0;1024;0;0;0;0;0;0;0;0;0;0;0;0;0;0;0;0;0;0;0;0;0;0;0;0;11;12;13;24;0;0;0;0;0;0;0;0;0;0;0;0;0;0;0;0;0;0;0;0;0;0;0;0;0;0;0;0;0;0;10;7;0;0;0;0;9;0;36;0;10;8590032;(null);0;0;0;0;0;0;0;0;0;0
4;nobleman;This guy's probably never worked a day in his life.;I spit on thee, you working-class knave.;4;;;;-1;1;1;0;0;0;5;7;7;12;13;9;8;8;0;0;90;20;4;30;1;3;0;0;0;0;0;0;0;1024;0;0;0;0;0;0;0;0;0;0;0;0;0;0;0;0;0;0;0;0;0;0;0;0;4;5;13;0;0;0;0;0;0;0;0;0;0;0;0;0;0;0;0;0;0;0;0;0;0;0;0;0;0;0;0;0;0;0;0;2;0;0;8;0;38;0;39;0;0;8593248;(null);0;0;0;0;0;0;0;0;0;0
5;bowyer;He's made so many bows in his day that he practically looks like one.;;5;;;;-1;2;1;0;0;0;50;10;13;11;11;11;20;20;0;0;70;18;20;0;2;2;2;0;0;0;0;0;0;1024;0;0;0;0;0;0;0;0;0;0;0;0;0;0;0;0;0;0;0;0;0;0;0;0;10;13;0;0;0;0;0;0;0;0;0;0;0;0;0;0;0;0;0;0;0;0;0;0;0;0;0;0;0;0;0;0;0;34;34;24;15;15;38;0;0;0;17;0;34;8596464;(null);0;0;0;0;0;0;0;0;0;0
6;merchant;She's a typical seedy-looking street-merchant.;Care to buy an apple?;6;;;;-1;1;1;0;0;0;20;11;11;11;11;11;8;8;0;0;90;19;6;2;1;3;0;0;0;0;0;0;0;1024;0;0;0;0;0;0;0;0;0;0;0;0;0;0;0;0;0;0;0;0;0;0;0;0;8;12;0;0;0;0;0;0;0;0;0;0;0;0;0;0;0;0;0;0;0;0;0;0;0;0;0;0;0;0;0;0;0;1;2;4;4;7;8;9;10;75;11;0;2;8599680;(null);0;0;0;0;0;0;0;0;0;0
7;sailor;He must be on leave from his ship in the Boraspian Sea.;Aye, where's the bordello?;7;;;;-1;1;1;0;0;0;15;12;11;11;10;11;10;10;0;0;85;19;10;0;2;2;1;0;0;0;0;0;0;1024;0;0;0;0;0;0;0;0;0;0;0;0;0;0;0;0;0;0;0;0;0;0;0;0;9;13;0;0;0;0;0;0;0;0;0;0;0;0;0;0;0;0;0;0;0;0;0;0;0;0;0;0;0;0;0;0;0;40;40;40;3;3;3;2;11;10;9;0;40;8602896;(null);0;0;0;0;0;0;0;0;0;0
8;peasant;The poor old sap probably learned to tie his shoes at age 18.;;8;;;;-1;1;1;0;0;0;70;13;10;11;7;11;6;6;0;0;90;19;3;0;1;4;0;0;0;0;0;0;0;1024;0;0;0;0;0;0;0;0;0;0;0;0;0;0;0;0;0;0;0;0;0;0;0;0;9;13;0;0;0;0;0;0;0;0;0;0;0;0;0;0;0;0;0;0;0;0;0;0;0;0;0;0;0;0;0;0;0;41;42;42;41;0;46;46;0;0;0;0;42;8606112;(null);0;0;0;0;0;0;0;0;0;0
9;monk;This monk has obviously been cooped up in a monastery too long. Pale as a sheet;;9;;;;-1;2;1;3;0;0;100;10;10;9;12;17;13;13;6;6;90;18;10;0;1;5;0;0;0;0;0;0;0;1024;0;0;0;0;0;0;0;0;1;2;0;0;0;0;0;0;0;0;0;0;0;0;0;0;18;0;0;0;0;0;0;0;0;0;0;0;0;0;0;0;0;0;0;0;0;0;0;0;0;0;0;0;0;0;0;0;0;43;36;44;50;50;50;50;43;50;36;0;36;8609328;(null);0;0;0;0;0;0;0;0;0;0
10;criminal;This hardened criminal has a small knife, and looks desperate.;hey asshole, give me all your money.  *spit*;10;;;;-1;1;1;0;0;0;-50;10;12;11;10;5;10;10;0;0;80;19;9;0;1;3;1;0;0;0;0;0;0;1024;0;0;0;0;0;0;0;0;0;0;0;0;0;0;0;0;0;0;0;0;0;0;0;0;7;10;13;0;0;0;0;0;0;0;0;0;0;0;0;0;0;0;0;0;0;0;0;0;0;0;0;0;0;0;0;0;0;20;20;4;3;12;26;24;2;1;1;0;20;8612544;(null);0;0;0;0;0;0;0;0;0;0
11;warrior;This warrior would make a most potent adversary.;You'll regret fighting me!;11;;;;-1;3;1;4;0;0;0;15;12;13;11;11;29;29;0;0;60;17;30;0;2;3;1;0;0;0;0;0;0;1024;0;0;0;0;0;0;0;0;0;0;0;0;0;0;0;0;0;0;0;0;0;0;0;0;7;9;13;0;0;0;0;0;0;0;0;0;0;0;0;0;0;0;0;0;0;0;0;0;0;0;0;0;0;0;0;0;0;23;22;32;26;26;33;20;0;0;19;0;22;8615760;(null);0;0;0;0;0;0;0;0;0;0
12;paladin;This righteous warrior stares down at you condescendingly.;It is my sincere hope that you have made your peace with God.;12;;;;-1;4;1;6;0;0;120;16;12;12;10;15;35;35;2;2;60;16;40;0;2;4;0;0;0;0;0;0;0;1024;0;0;0;0;0;0;0;0;1;0;0;0;0;0;0;0;0;0;0;0;0;0;0;0;8;13;18;0;0;0;0;0;0;0;0;0;0;0;0;0;0;0;0;0;0;0;0;0;0;0;0;0;0;0;0;0;0;53;43;31;32;22;29;26;0;43;0;0;43;8618976;(null);0;0;0;0;0;0;0;0;0;0
13;ranger;This solitary ranger blends in so well with his surroundings you hardly see him;<hmph>;13;;;;-1;4;1;7;0;0;80;12;16;11;11;11;40;40;1;1;60;14;60;0;2;3;2;0;0;0;0;0;0;1024;0;0;0;0;0;0;0;0;0;0;0;0;0;0;0;0;0;0;0;0;0;0;0;0;8;10;13;0;0;0;0;0;0;0;0;0;0;0;0;0;0;0;0;0;0;0;0;0;0;0;0;0;0;0;0;0;0;19;33;34;6;37;0;0;19;34;0;0;33;8622192;(null);0;0;0;0;0;0;0;0;0;0
14;knight;The regal knight stands before you, suited completely in glimmering armor.;Greetings! Hail and well met, young one!;14;;;;-1;4;1;0;0;0;65;15;11;11;11;11;36;36;0;0;60;16;40;0;1;8;0;0;0;0;0;0;0;1024;0;0;0;0;0;0;0;0;0;0;0;0;0;0;0;0;0;0;0;0;0;0;0;0;9;13;41;0;0;0;0;0;0;0;0;0;0;0;0;0;0;0;0;0;0;0;0;0;0;0;0;0;0;0;0;0;0;78;29;32;32;22;28;92;29;51;65;0;29;8625408;(null);0;0;0;0;0;0;0;0;0;0
15;mercenary;She is a battle-worn mercenary, looking for her next easy kill.;;15;;;;-1;3;1;4;0;0;-25;13;11;13;11;11;30;30;0;0;70;17;35;10;1;7;0;0;0;0;0;0;0;1024;0;0;0;0;0;0;0;0;0;0;0;0;0;0;0;0;0;0;0;0;0;0;0;0;7;9;0;0;0;0;0;0;0;0;0;0;0;0;0;0;0;0;0;0;0;0;0;0;0;0;0;0;0;0;0;0;0;0;0;0;23;24;26;27;15;16;17;0;0;8628624;(null);0;0;0;0;0;0;0;0;0;0
16;small spider;;;16;spider;;;-1;1;1;0;0;0;-25;8;14;11;11;11;10;10;0;0;90;17;7;0;1;3;0;0;0;0;0;0;0;1024;0;0;0;0;0;0;0;0;0;0;0;0;0;0;0;0;0;0;0;0;0;0;0;0;13;14;0;0;0;0;0;0;0;0;0;0;0;0;0;0;0;0;0;0;0;0;0;0;0;0;0;0;0;0;0;0;0;0;0;0;0;0;0;0;0;0;0;0;0;8631840;(null);0;0;0;0;0;0;0;0;0;0
17;giant rat;The rat's looking for food, and he thinks you're it!;<squeak>;17;rat;;;-1;2;1;0;0;0;-30;11;14;11;5;5;16;16;0;0;80;18;7;0;1;5;0;0;0;0;0;0;0;1024;0;0;0;0;0;0;0;0;0;0;0;0;0;0;0;0;0;0;0;0;0;0;0;0;7;10;11;13;0;0;0;0;0;0;0;0;0;0;0;0;0;0;0;0;0;0;0;0;0;0;0;0;0;0;0;0;0;0;0;0;0;0;0;0;0;0;0;0;0;8635056;(null);0;0;0;0;0;0;0;0;0;0
18;ghost;The ghost is nearly shapeless, so you cannot make out who it might be.;Boo!;18;;;;-1;4;1;0;0;0;-75;12;12;11;8;8;30;30;0;0;60;17;40;0;1;8;0;0;0;0;0;0;0;1024;0;0;0;0;0;0;0;0;0;0;0;0;0;0;0;0;0;0;0;0;0;0;0;0;13;15;0;0;0;0;0;0;0;0;0;0;0;0;0;0;0;0;0;0;0;0;0;0;0;0;0;0;0;0;0;0;0;47;47;0;0;47;0;0;0;0;0;0;47;8638272;(null);0;0;0;0;0;0;0;0;0;0
19;apparition;It's an apparition of a wrinkled old woman.;WooooooOOOooooooooooo;19;;;;-1;5;1;0;0;0;-50;11;17;11;11;11;45;45;0;0;50;15;65;0;2;4;2;0;0;0;0;0;0;1024;0;0;0;0;0;0;0;0;0;0;0;0;0;0;0;0;0;0;0;0;0;0;0;0;10;15;0;0;0;0;0;0;0;0;0;0;0;0;0;0;0;0;0;0;0;0;0;0;0;0;0;0;0;0;0;0;0;52;52;53;53;0;0;0;52;53;52;0;52;8641488;(null);0;0;0;0;0;0;0;0;0;0
20;evil wraith;The wraith stands before you with globs of flesh dripping from its bones;Beware. I come to kill.;20;wraith;;;-1;5;1;0;0;0;-200;14;14;11;11;11;52;52;0;0;50;15;75;0;2;5;0;0;0;0;0;0;0;1024;0;0;0;0;0;0;0;0;0;0;0;0;0;0;0;0;0;0;0;0;0;0;0;0;7;9;12;13;15;0;0;0;0;0;0;0;0;0;0;0;0;0;0;0;0;0;0;0;0;0;0;0;0;0;0;0;0;51;54;83;0;36;36;36;35;37;47;0;54;8644704;(null);0;0;0;0;0;0;0;0;0;0
21;little mouse;He's hoping he doesn't get his tail cut off by the farmer's wife.;<squeak>!;21;mouse;;;-1;1;1;0;0;0;20;8;8;8;8;8;5;5;0;0;100;20;1;0;1;3;0;0;0;0;0;0;0;1024;0;0;0;0;0;0;0;0;0;0;0;0;0;0;0;0;0;0;0;0;0;0;0;0;11;13;0;0;0;0;0;0;0;0;0;0;0;0;0;0;0;0;0;0;0;0;0;0;0;0;0;0;0;0;0;0;0;0;0;0;0;0;0;0;0;0;0;0;0;8647920;(null);0;0;0;0;0;0;0;0;0;0
22;old gardener;The extremely old man is busy raking the lawn of the ominous house.;I rake, I hoe, I walk, I mow.  It's my job, you know?;22;gardener;;;-1;4;1;4;0;0;100;14;12;11;11;11;40;40;0;0;60;14;40;0;2;5;0;0;0;0;0;0;0;1024;0;0;0;0;0;0;0;0;0;0;0;0;0;0;0;0;0;0;0;0;0;0;0;0;8;9;12;13;15;0;0;0;0;0;0;0;0;0;0;0;0;0;0;0;0;0;0;0;0;0;0;0;0;0;0;0;0;49;49;49;49;49;49;49;49;49;49;0;49;8651136;(null);0;0;0;0;0;0;0;0;0;0
23;ghoul;He has blood dripping from his mouth - probably that of his last victim.;Ha Ha Ha! I can smell your blood.  You're next;23;;;;-1;5;1;0;0;0;-100;14;14;11;11;11;47;47;0;0;50;15;80;0;1;8;2;0;0;0;0;0;0;1024;0;0;0;0;0;0;0;0;0;0;0;0;0;0;0;0;0;0;0;0;0;0;0;0;7;10;11;13;15;0;0;0;0;0;0;0;0;0;0;0;0;0;0;0;0;0;0;0;0;0;0;0;0;0;0;0;0;54;55;35;37;0;0;0;0;54;55;0;55;8654352;(null);0;0;0;0;0;0;0;0;0;0
24;ghast;The ghast appears as a horrifying apparition of a dead man.;Boo!;24;;;;-1;4;1;0;0;0;-120;12;12;11;11;11;36;36;0;0;60;16;40;0;1;6;2;0;0;0;0;0;0;1024;0;0;0;0;0;0;0;0;0;0;0;0;0;0;0;0;0;0;0;0;0;0;0;0;7;10;13;15;0;0;0;0;0;0;0;0;0;0;0;0;0;0;0;0;0;0;0;0;0;0;0;0;0;0;0;0;0;35;0;35;0;47;0;0;47;0;0;0;0;8657568;(null);0;0;0;0;0;0;0;0;0;0
25;madman;This wild madman looks like he was someone's failed experiment.;You die sucker!;25;;;;-1;1;1;0;0;3;-50;13;12;11;10;5;10;10;0;0;90;19;10;0;2;2;0;0;0;0;0;0;0;1024;0;0;0;0;0;0;0;0;0;0;0;0;0;0;0;0;0;0;0;0;0;0;0;0;4;7;10;13;0;0;0;0;0;0;0;0;0;0;0;0;0;0;0;0;0;0;0;0;0;0;0;0;0;0;0;0;0;30;0;0;0;0;0;0;0;0;0;0;0;8660784;(null);0;0;0;0;0;0;0;0;0;0
26;dwarf;Although quite small, this dwarf can be a tough adversary;Are you making fun of me?;26;;;;-1;5;1;0;0;0;50;12;18;11;11;11;60;60;0;0;50;15;100;10;2;5;0;0;0;0;0;0;0;1024;0;0;0;0;0;0;0;0;0;0;0;0;0;0;0;0;0;0;0;0;0;0;0;0;5;13;0;0;0;0;0;0;0;0;0;0;0;0;0;0;0;0;0;0;0;0;0;0;0;0;0;0;0;0;0;0;0;57;26;57;57;0;0;29;29;0;0;0;26;8664000;(null);0;0;0;0;0;0;0;0;0;0
27;minotaur;This wild creature has a horn on its forehead.;<growl>;27;;;;-1;4;1;0;0;0;-50;16;12;11;11;8;45;45;0;0;75;16;40;0;2;4;1;0;0;0;0;0;0;1024;0;0;0;0;0;0;0;0;0;0;0;0;0;0;0;0;0;0;0;0;0;0;0;0;7;13;0;0;0;0;0;0;0;0;0;0;0;0;0;0;0;0;0;0;0;0;0;0;0;0;0;0;0;0;0;0;0;172;0;0;172;0;0;0;172;0;0;0;0;8667216;(null);0;0;0;0;0;0;0;0;0;0
28;swordmaster;The swordsman guild has certified him a master craftsman.;I'll cut you up fast.;28;;;;-1;5;1;0;0;0;50;17;14;11;11;8;60;60;0;0;50;15;80;0;3;3;1;0;0;0;0;0;0;1024;0;0;0;0;0;0;0;0;0;0;0;0;0;0;0;0;0;0;0;0;0;0;0;0;13;0;0;0;0;0;0;0;0;0;0;0;0;0;0;0;0;0;0;0;0;0;0;0;0;0;0;0;0;0;0;0;0;58;77;113;113;256;280;280;0;0;0;0;77;8670432;(null);0;0;0;0;0;0;0;0;0;0
29;centaur;You see a man, a horse, or both?;get your hands off my ass!;29;;;;-1;8;1;0;0;0;50;15;15;16;15;15;100;100;0;0;40;12;220;0;3;5;1;0;0;0;0;0;0;1024;0;0;0;0;0;0;0;0;0;0;0;0;0;0;0;0;0;0;0;0;0;0;0;0;13;0;0;0;0;0;0;0;0;0;0;0;0;0;0;0;0;0;0;0;0;0;0;0;0;0;0;0;0;0;0;0;0;60;51;54;0;60;189;189;0;0;0;0;51;8673648;(null);0;0;0;0;0;0;0;0;0;0
30;guard;This guard looks like he's made out of rock.  You better do what he says.;hey you, get the hell outta here!;30;;;;-1;10;1;0;0;0;250;16;16;18;15;15;135;135;0;0;20;10;340;50;3;6;0;0;0;0;0;0;0;1024;0;0;0;0;0;0;0;0;0;0;0;0;0;0;0;0;0;0;0;0;0;0;0;0;8;9;10;11;13;16;0;0;0;0;0;0;0;0;0;0;0;0;0;0;0;0;0;0;0;0;0;0;0;0;0;0;0;280;280;280;280;280;280;250;250;250;250;0;280;8676864;(null);0;0;0;0;0;0;0;0;0;0
31;headless horseman;You know... like the one who haunted Ichabod Crane.;Ha!  And you thought I wouldn't be able to talk!;31;horseman;;;-1;7;1;0;0;0;-100;16;16;16;11;11;80;80;0;0;30;13;150;0;3;4;0;0;0;0;0;0;0;1024;0;0;0;0;0;0;0;0;0;0;0;0;0;0;0;0;0;0;0;0;0;0;0;0;4;5;7;10;13;15;0;0;0;0;0;0;0;0;0;0;0;0;0;0;0;0;0;0;0;0;0;0;0;0;0;0;0;66;66;66;66;59;59;48;66;97;97;0;66;8680080;(null);0;0;0;0;0;0;0;0;0;0
32;spectre;The spectre is a demonic-looking creature, dark as a shadow.;Your soul is mine.;32;;;;-1;9;1;0;0;0;-150;18;17;18;11;11;110;110;12;12;20;11;280;0;3;5;3;0;0;0;0;0;0;1024;0;0;0;0;0;0;0;0;2;7;0;0;0;0;0;0;0;0;0;0;0;0;0;0;7;10;13;15;16;18;0;0;0;0;0;0;0;0;0;0;0;0;0;0;0;0;0;0;0;0;0;0;0;0;0;0;0;67;67;58;52;83;54;66;65;60;83;0;67;8683296;(null);0;0;0;0;0;0;0;0;0;0
33;skeleton;The skeleton is an animated pile of bones.;Die, fool;33;;;;-1;4;1;0;0;0;-50;13;13;10;10;10;38;38;0;0;60;16;45;0;1;8;0;0;0;0;0;0;0;1024;0;0;0;0;0;0;0;0;0;0;0;0;0;0;0;0;0;0;0;0;0;0;0;0;7;8;12;15;0;0;0;0;0;0;0;0;0;0;0;0;0;0;0;0;0;0;0;0;0;0;0;0;0;0;0;0;0;72;3;32;26;26;37;52;0;23;0;0;3;8686512;(null);0;0;0;0;0;0;0;0;0;0
34;vampire;You know it's a vampire simply by seeing its protruding incisors.;I vant to suck your blood!;34;;;;-1;7;1;0;0;0;-80;15;15;15;16;8;77;77;0;0;40;13;150;0;1;12;2;0;0;0;0;0;0;1024;0;0;0;0;0;0;0;0;0;0;0;0;0;0;0;0;0;0;0;0;0;0;0;0;7;9;11;13;15;0;0;0;0;0;0;0;0;0;0;0;0;0;0;0;0;0;0;0;0;0;0;0;0;0;0;0;0;70;71;37;47;65;59;59;67;53;53;0;71;8689728;(null);0;0;0;0;0;0;0;0;0;0
35;warg;The warg stares at you from vacant eyes.;WooooOOOooo;35;;;;-1;6;1;0;0;0;-50;16;18;16;12;7;66;66;0;0;50;14;110;0;2;5;0;0;0;0;0;0;0;1024;0;0;0;0;0;0;0;0;0;0;0;0;0;0;0;0;0;0;0;0;0;0;0;0;7;10;11;13;15;0;0;0;0;0;0;0;0;0;0;0;0;0;0;0;0;0;0;0;0;0;0;0;0;0;0;0;0;69;67;59;57;54;0;0;0;0;0;0;67;8692944;(null);0;0;0;0;0;0;0;0;0;0
36;the ghost of Evan Nildredge;He was once the owner of this mansion, but now is merely a ghost.;Oh how I long to live in this abode as a living being once again.;36;evan;ghost;nildredge;-1;13;1;0;0;0;0;18;16;12;17;20;160;160;15;15;10;8;500;80;3;7;1;0;0;0;0;0;0;1024;0;0;0;0;0;0;0;0;7;0;0;0;0;0;0;0;0;0;0;0;0;0;0;0;6;12;13;15;16;18;0;0;0;0;0;0;0;0;0;0;0;0;0;0;0;0;0;0;0;0;0;0;0;0;0;0;0;74;74;74;74;74;74;74;74;74;74;0;74;8696160;(null);0;0;0;0;0;0;0;0;0;0
37;zombie;Flesh hangs loosely from his bones as he wanders aimlessly toward you.;MmmmmmmmMMMmm;37;;;;-1;6;1;0;0;0;-50;18;8;20;11;11;70;70;0;0;40;14;120;0;2;4;2;0;0;0;0;0;0;1024;0;0;0;0;0;0;0;0;0;0;0;0;0;0;0;0;0;0;0;0;0;0;0;0;7;9;13;15;23;0;0;0;0;0;0;0;0;0;0;0;0;0;0;0;0;0;0;0;0;0;0;0;0;0;0;0;0;67;71;75;58;52;52;52;51;0;0;0;71;8699376;(null);0;0;0;0;0;0;0;0;0;0
38;looter;He's got a sack draped over his shoulder, ready to loot anything in sight.;Get out of my way, you amateur.;38;;;;-1;5;1;0;0;0;-30;13;13;11;11;11;47;47;0;0;60;14;75;0;1;8;1;0;0;0;0;0;0;1024;0;0;0;0;0;0;0;0;0;0;0;0;0;0;0;0;0;0;0;0;0;0;0;0;8;10;12;0;0;0;0;0;0;0;0;0;0;0;0;0;0;0;0;0;0;0;0;0;0;0;0;0;0;0;0;0;0;69;83;69;76;76;76;75;79;83;83;0;83;8702592;(null);0;0;0;0;0;0;0;0;0;0
39;ghostly fencer;This ghost appears as a fencer, fully decked out in fencer's garb.;En Guarde!;39;fencer;;;-1;8;1;0;0;0;-50;14;16;13;11;11;100;100;0;0;30;12;200;0;2;4;3;0;0;0;0;0;0;1024;0;0;0;0;0;0;0;0;0;0;0;0;0;0;0;0;0;0;0;0;0;0;0;0;13;15;16;0;0;0;0;0;0;0;0;0;0;0;0;0;0;0;0;0;0;0;0;0;0;0;0;0;0;0;0;0;0;81;81;80;45;75;71;68;77;80;77;0;81;8705808;(null);0;0;0;0;0;0;0;0;0;0
40;sewer rat;It's covered in sewer-goop.;<growl>;40;rat;;;-1;2;1;0;0;0;-20;12;14;11;11;11;20;20;0;0;80;18;20;0;1;6;0;0;0;0;0;0;0;1024;0;0;0;0;0;0;0;0;0;0;0;0;0;0;0;0;0;0;0;0;0;0;0;0;7;10;11;13;14;0;0;0;0;0;0;0;0;0;0;0;0;0;0;0;0;0;0;0;0;0;0;0;0;0;0;0;0;98;0;93;0;0;98;0;0;0;0;0;0;8709024;(null);0;0;0;0;0;0;0;0;0;0
41;lillianril;The tall plant-like creature stares at you through 18 eye-stalks.;<pht>;41;;;;-1;8;1;0;0;0;-50;16;16;16;15;15;100;100;12;12;40;12;220;0;4;4;0;0;0;0;0;0;0;1024;0;0;0;0;0;0;0;0;2;0;0;0;0;0;0;0;0;0;0;0;0;0;0;0;7;9;12;18;0;0;0;0;0;0;0;0;0;0;0;0;0;0;0;0;0;0;0;0;0;0;0;0;0;0;0;0;0;85;86;86;89;94;95;96;0;97;85;0;86;8712240;(null);0;0;0;0;0;0;0;0;0;0
42;dervish;The dervish is a small, swarthy-looking thief.;Hand it over, fool;42;;;;-1;5;1;0;0;0;-90;15;16;11;11;11;50;50;0;0;50;15;80;20;2;4;0;0;0;0;0;0;0;1024;0;0;0;0;0;0;0;0;0;0;0;0;0;0;0;0;0;0;0;0;0;0;0;0;7;8;10;12;13;0;0;0;0;0;0;0;0;0;0;0;0;0;0;0;0;0;0;0;0;0;0;0;0;0;0;0;0;92;97;97;77;46;46;24;32;71;76;0;97;8715456;(null);0;0;0;0;0;0;0;0;0;0
43;orc;The orc is a perversion of the elven race.;you're not an elf, are you?  I hate elves!;43;;;;-1;4;1;0;0;0;-20;13;10;11;11;11;36;36;0;0;60;16;40;0;1;7;0;0;0;0;0;0;0;1024;0;0;0;0;0;0;0;0;0;0;0;0;0;0;0;0;0;0;0;0;0;0;0;0;7;9;11;13;0;0;0;0;0;0;0;0;0;0;0;0;0;0;0;0;0;0;0;0;0;0;0;0;0;0;0;0;0;90;96;38;10;18;20;26;34;52;52;0;96;8718672;(null);0;0;0;0;0;0;0;0;0;0
44;worker;She's just a typical sewer worker doing typical sewer work.;Don't worry, you get used to the smell.;44;;;;-1;3;1;0;0;0;50;11;12;12;11;11;23;23;0;0;70;17;35;0;2;2;1;0;0;0;0;0;0;1024;0;0;0;0;0;0;0;0;0;0;0;0;0;0;0;0;0;0;0;0;0;0;0;0;11;0;0;0;0;0;0;0;0;0;0;0;0;0;0;0;0;0;0;0;0;0;0;0;0;0;0;0;0;0;0;0;0;46;46;46;36;62;31;0;0;20;6;0;46;8721888;(null);0;0;0;0;0;0;0;0;0;0
45;thief;You almost didn't see him.  He blends in with his surroundings quite well.;Cross me, and die;45;;;;-1;6;1;0;0;0;-40;15;16;15;15;6;60;60;0;0;40;14;125;0;1;12;0;0;0;0;0;0;0;1024;0;0;0;0;0;0;0;0;0;0;0;0;0;0;0;0;0;0;0;0;0;0;0;0;8;10;12;13;0;0;0;0;0;0;0;0;0;0;0;0;0;0;0;0;0;0;0;0;0;0;0;0;0;0;0;0;0;97;80;80;96;96;91;87;85;70;65;0;80;8725104;(null);0;0;0;0;0;0;0;0;0;0
46;kobold;The kobold appears as a sort of upright-walking dog creature.;Bark!;46;;;;-1;4;1;0;0;0;-20;10;11;11;11;11;37;37;0;0;70;16;40;0;2;3;1;0;0;0;0;0;0;1024;0;0;0;0;0;0;0;0;0;0;0;0;0;0;0;0;0;0;0;0;0;0;0;0;7;13;0;0;0;0;0;0;0;0;0;0;0;0;0;0;0;0;0;0;0;0;0;0;0;0;0;0;0;0;0;0;0;71;58;51;51;33;46;69;0;0;0;0;58;8728320;(null);0;0;0;0;0;0;0;0;0;0
47;carrion crawler;The carrion crawler is a large multiped with a large mouth for eating flesh.;<phhht>;47;crawler;;;-1;6;1;0;0;0;-10;15;16;18;4;8;70;70;0;0;50;14;120;0;4;2;2;0;0;0;0;0;0;1024;0;0;0;0;0;0;0;0;0;0;0;0;0;0;0;0;0;0;0;0;0;0;0;0;7;13;14;0;0;0;0;0;0;0;0;0;0;0;0;0;0;0;0;0;0;0;0;0;0;0;0;0;0;0;0;0;0;96;0;94;0;89;0;92;0;51;0;0;0;8731536;(null);0;0;0;0;0;0;0;0;0;0
48;pugilist;The pugilist fights only with his hands, but he does quite well with them.;Put yer dukes up!;48;;;;-1;7;1;0;0;0;30;15;15;15;11;11;80;80;0;0;40;13;140;0;2;5;4;0;0;0;0;0;0;1024;0;0;0;0;0;0;0;0;0;0;0;0;0;0;0;0;0;0;0;0;0;0;0;0;9;13;0;0;0;0;0;0;0;0;0;0;0;0;0;0;0;0;0;0;0;0;0;0;0;0;0;0;0;0;0;0;0;87;87;89;89;90;91;92;92;97;94;0;87;8734752;(null);0;0;0;0;0;0;0;0;0;0
49;deadly kraken;The kraken is like an octopus, only 20 times larger.;HOW DARE YOU DISTURB MY HUMBLE ABODE!;49;kraken;deadly;;-1;14;1;0;0;0;-100;21;21;15;11;11;170;170;15;15;20;9;800;500;4;5;0;0;0;0;0;0;0;1024;0;0;0;0;0;0;0;0;0;0;0;0;0;0;0;0;0;0;0;0;0;0;0;0;7;8;13;14;16;0;0;0;0;0;0;0;0;0;0;0;0;0;0;0;0;0;0;0;0;0;0;0;0;0;0;0;0;99;100;99;100;99;100;99;100;99;100;0;100;8737968;(null);0;0;0;0;0;0;0;0;0;0
50;grinning demon;The demon has an evil grin etched in its blackened face.;You have certainly come to grant me your soul.;50;demon;;;-1;11;1;0;0;0;-200;19;16;11;12;13;135;135;12;12;10;9;450;500;3;6;1;0;0;0;0;0;0;1024;0;0;0;0;0;0;0;0;2;7;0;0;0;0;0;0;0;0;0;0;0;0;0;0;7;13;16;18;0;0;0;0;0;0;0;0;0;0;0;0;0;0;0;0;0;0;0;0;0;0;0;0;0;0;0;0;0;88;88;88;88;88;88;88;88;88;88;0;88;8741184;(null);0;0;0;0;0;0;0;0;0;0
51;gray elf;The most noble and intelligent of the elven-kind;Greetings great warriors.  May luck be with you on your quest;51;gray;elf;;-1;6;1;0;0;0;250;15;15;15;15;10;70;70;10;10;55;14;140;10;4;3;0;0;0;0;0;0;0;1024;0;0;0;0;0;0;0;0;1;2;7;0;0;0;0;0;0;0;0;0;0;0;0;0;8;10;16;18;22;0;0;0;0;0;0;0;0;0;0;0;0;0;0;0;0;0;0;0;0;0;0;0;0;0;0;0;0;46;37;48;60;0;0;0;0;0;0;0;37;8744400;(null);0;0;0;0;0;0;0;0;0;0
52;drow elf;Deadly black elf.  You can hardly see him in the shaddows.;How dare you invade my lair.  Leave now or be destroyed.;52;drow;elf;;-1;4;1;0;0;2;-25;18;10;10;15;10;40;40;20;20;60;17;55;50;2;4;0;0;0;0;0;0;0;1024;0;0;0;0;0;0;0;0;0;0;0;0;0;0;0;0;0;0;0;0;0;0;0;0;7;8;9;10;13;22;0;0;0;0;0;0;0;0;0;0;0;0;0;0;0;0;0;0;0;0;0;0;0;0;0;0;0;26;47;83;97;0;0;0;0;0;0;0;47;8747616;(null);0;0;0;0;0;0;0;0;0;0
53;lich;A powerful lich stares at you with a hypnotic eye.;Come with me to the underworld.  I will take you there.;53;lich;;;-1;12;1;5;0;0;-100;18;18;18;20;14;155;155;100;100;0;10;600;237;4;6;2;0;0;0;0;0;0;1024;0;0;0;0;0;0;0;0;2;7;12;13;14;15;0;0;0;0;0;0;0;0;0;0;7;8;9;13;14;15;16;18;22;0;0;0;0;0;0;0;0;0;0;0;0;0;0;0;0;0;0;0;0;0;0;0;0;103;70;72;78;102;0;0;0;0;0;1910;70;8750832;(null);0;0;0;0;0;0;0;0;0;0
54;hydra;A seven headed hydra looks at you.  You hope she has already eaten.;Won't you be my guest for dinner.  I haven't had humans in a long time.;54;hydra;;;-1;15;1;0;0;0;-100;20;25;20;15;20;210;210;125;125;0;5;1000;2500;5;6;0;0;0;0;0;0;0;1024;0;0;0;0;0;0;0;0;7;0;0;0;0;0;0;0;0;0;0;0;0;0;0;0;7;8;9;14;16;18;20;22;0;0;0;0;0;0;0;0;0;0;0;0;0;0;0;0;0;0;0;0;0;0;0;0;0;45;102;111;99;108;174;269;214;174;280;0;102;8754048;(null);0;0;0;0;0;0;0;0;0;0
55;efreeti;An evil efreeti stares down at you in disgust.;You dare to challenge the elemental plane of fire?!?;55;efreeti;;;-1;15;1;0;0;0;-20;20;20;20;20;20;210;210;50;50;0;5;900;1000;4;7;2;0;0;0;0;0;0;1024;0;0;0;0;0;0;0;0;1;2;7;0;0;0;0;0;0;0;0;0;0;0;0;0;8;9;13;16;18;22;0;0;0;0;0;0;0;0;0;0;0;0;0;0;0;0;0;0;0;0;0;0;0;0;0;0;0;102;111;103;125;126;129;0;0;0;0;0;111;8757264;(null);0;0;0;0;0;0;0;0;0;0
56;black dragon;A rather large black lizard stares at you.;Hmmm...should I eat you now or save you for dinner.;56;black;dragon;;-1;17;1;0;0;0;-120;20;20;20;25;20;190;190;500;500;-35;3;1200;500;6;3;2;0;0;0;0;0;0;1024;0;0;0;0;0;0;0;0;1;2;0;0;0;0;0;0;0;0;0;0;0;0;0;0;7;8;9;13;16;18;20;22;0;0;0;0;0;0;0;0;0;0;0;0;0;0;0;0;0;0;0;0;0;0;0;0;0;102;111;270;75;76;89;276;407;284;407;0;111;8760480;(null);0;0;0;0;0;0;0;0;0;0
57;brass dragon;You see a small glimmering dragon.  Doesn't look like it could hurt a fly.;What is your purpose?;57;dragon; ;;-1;17;1;0;0;0;150;20;20;20;20;20;200;200;200;200;-35;3;1300;1000;4;6;1;0;0;0;0;0;0;1024;0;0;0;0;0;0;0;0;0;0;0;0;0;0;0;0;0;0;0;0;0;0;0;0;8;9;13;16;18;20;0;0;0;0;0;0;0;0;0;0;0;0;0;0;0;0;0;0;0;0;0;0;0;0;0;0;0;102;97;119;79;51;50;316;119;370;369;0;97;8763696;(null);0;0;0;0;0;0;0;0;0;0
58;blue dragon;You see a large and angry looking blue dragon.;I'm in a pissed off mood....prepare to die.;58;blue;dragon;;-1;19;1;0;0;0;-50;25;25;20;25;20;250;250;300;300;-70;-1;1600;1000;6;5;0;0;0;0;0;0;0;1024;0;0;0;0;0;0;0;0;0;0;0;0;0;0;0;0;0;0;0;0;0;0;0;0;7;8;9;13;14;16;18;20;22;0;0;0;0;0;0;0;0;0;0;0;0;0;0;0;0;0;0;0;0;0;0;0;0;158;199;57;58;369;368;387;386;385;158;0;199;8766912;(null);0;0;0;0;0;0;0;0;0;0
59;green dragon;You see a hideous looking green dragon as it swoops down upon you.;It is a good day to die.;59;green;dragon;;-1;18;1;0;0;0;-125;25;25;25;23;10;220;220;300;300;-60;0;1450;1000;8;4;1;0;0;0;0;0;0;1024;0;0;0;0;0;0;0;0;0;0;0;0;0;0;0;0;0;0;0;0;0;0;0;0;7;8;9;13;16;18;20;22;29;0;0;0;0;0;0;0;0;0;0;0;0;0;0;0;0;0;0;0;0;0;0;0;0;29;45;95;94;83;72;76;72;66;60;0;45;8770128;(null);0;0;0;0;0;0;0;0;0;0
60;half-elf;This elf is larger than you're used to.  He must be half-human.;All I do is clean up after you humans.  Can't you be more courteous?;60;half;elf;;-1;4;1;0;0;0;100;15;15;20;17;10;30;30;30;30;60;16;50;50;2;3;2;0;0;0;0;0;0;1024;0;0;0;0;0;0;0;0;1;2;0;0;0;0;0;0;0;0;0;0;0;0;0;0;8;9;10;13;18;22;0;0;0;0;0;0;0;0;0;0;0;0;0;0;0;0;0;0;0;0;0;0;0;0;0;0;0;0;0;0;0;0;0;0;0;0;0;0;0;8773344;(null);0;0;0;0;0;0;0;0;0;0
61;waitress;You see a cute waitress holding a tray of drinks.;Can I get you something to drink?;61;waitress;;;-1;1;1;0;0;0;50;15;15;10;10;5;10;10;0;0;90;20;7;2;1;4;0;0;0;0;0;0;0;1024;0;0;0;0;0;0;0;0;0;0;0;0;0;0;0;0;0;0;0;0;0;0;0;0;10;0;0;0;0;0;0;0;0;0;0;0;0;0;0;0;0;0;0;0;0;0;0;0;0;0;0;0;0;0;0;0;0;7;8;9;10;11;12;1;2;3;4;0;8;8776560;(null);0;0;0;0;0;0;0;0;0;0
62;aristocrat;You see an aristocrat, one of the mayor's personal friends.;I fart in your general direction.;62;aristocrat;;;-1;1;1;0;0;0;-10;10;10;10;5;5;10;10;0;0;85;20;8;30;1;5;0;0;0;0;0;0;0;1024;0;0;0;0;0;0;0;0;0;0;0;0;0;0;0;0;0;0;0;0;0;0;0;0;13;0;0;0;0;0;0;0;0;0;0;0;0;0;0;0;0;0;0;0;0;0;0;0;0;0;0;0;0;0;0;0;0;31;23;14;39;44;6;5;8;11;7;0;23;8779776;(null);0;0;0;0;0;0;0;0;0;0
63;dikumud ripoff;You see the stupid dikumud ripoff.;Don't tell me you want money too.;63;mayor;;;-1;2;1;0;0;0;20;15;10;10;10;5;20;20;5;5;80;19;15;10;1;6;0;0;0;0;0;0;0;1024;0;0;0;0;0;0;0;0;0;0;0;0;0;0;0;0;0;0;0;0;0;0;0;0;10;13;0;0;0;0;0;0;0;0;0;0;0;0;0;0;0;0;0;0;0;0;0;0;0;0;0;0;0;0;0;0;0;34;34;38;39;71;62;56;51;53;103;0;34;8782992;(null);0;0;0;0;0;0;0;0;0;0
64;bartender;You see a master bartender mixing and serving up drinks.;What'll yew have, m'friend?;64;bartender;;;-1;3;1;0;0;0;30;15;15;10;10;10;20;20;5;5;90;18;15;20;1;6;1;0;0;0;0;0;0;1024;0;0;0;0;0;0;0;0;0;0;0;0;0;0;0;0;0;0;0;0;0;0;0;0;13;0;0;0;0;0;0;0;0;0;0;0;0;0;0;0;0;0;0;0;0;0;0;0;0;0;0;0;0;0;0;0;0;56;62;67;5;6;20;21;24;2;12;0;62;8786208;(null);0;0;0;0;0;0;0;0;0;0
65;drunk;He smells and looks quite disgusting.;<Hick!>;65;;;;-1;1;1;0;0;0;30;11;4;5;6;7;10;10;0;0;90;19;7;10;1;4;2;0;0;0;0;0;0;1024;0;0;0;0;0;0;0;0;0;0;0;0;0;0;0;0;0;0;0;0;0;0;0;0;13;0;0;0;0;0;0;0;0;0;0;0;0;0;0;0;0;0;0;0;0;0;0;0;0;0;0;0;0;0;0;0;0;0;0;0;0;0;0;0;0;0;0;0;0;8789424;(null);0;0;0;0;0;0;0;0;0;0
66;rabbit;You see a cute little bunny rabbit, with long ears.;;66;;;;-1;1;1;0;0;0;50;10;14;12;5;10;6;6;0;0;100;19;4;0;1;3;1;0;0;0;0;0;0;1024;0;0;0;0;0;0;0;0;0;0;0;0;0;0;0;0;0;0;0;0;0;0;0;0;0;0;0;0;0;0;0;0;0;0;0;0;0;0;0;0;0;0;0;0;0;0;0;0;0;0;0;0;0;0;0;0;0;0;0;0;0;0;0;0;0;0;0;0;0;8792640;(null);0;0;0;0;0;0;0;0;0;0
67;troll;You see a very ugly troll, with a wide mouth full of sharp teeth.;you look good enough to eat, except you stink so bad you turn my stomach!;67;troll;;;-1;4;1;0;0;2;-50;18;15;12;10;10;45;45;0;0;65;17;60;100;3;2;2;0;0;0;0;0;0;1024;0;0;0;0;0;0;0;0;0;0;0;0;0;0;0;0;0;0;0;0;0;0;0;0;7;8;9;10;13;16;22;0;0;0;0;0;0;0;0;0;0;0;0;0;0;0;0;0;0;0;0;0;0;0;0;0;0;32;34;0;247;113;83;247;0;0;0;0;34;8795856;(null);0;0;0;0;0;0;0;0;0;0
