198;traveling minstrel;You see a young bard with a mandolin singing a song.;Would you like to hear a story about Lord Itinar?;198;minstrel;;;-1;1;1;0;0;4;25;10;12;10;15;12;8;8;0;0;85;19;8;0;1;4;0;0;0;0;0;0;0;1024;0;0;0;0;0;0;0;0;0;0;0;0;0;0;0;0;0;0;0;0;0;0;0;0;13;0;0;0;0;0;0;0;0;0;0;0;0;0;0;0;0;0;0;0;0;0;0;0;0;0;0;0;0;0;0;0;0;244;245;244;245;246;245;244;245;246;246;0;245;9217152;(null);0;0;0;0;0;0;0;0;0;0
199;cold drake;It's a small dragon-like creature, frosted and white.;Chirp!;199;drake;;;-1;7;1;0;0;2;-50;14;18;17;12;8;90;90;30;30;40;13;200;0;2;6;0;0;0;0;0;0;0;1024;0;0;0;0;0;0;0;0;0;0;0;0;0;0;0;0;0;0;0;0;0;0;0;0;7;10;13;14;18;0;0;0;0;0;0;0;0;0;0;0;0;0;0;0;0;0;0;0;0;0;0;0;0;0;0;0;0;94;284;85;66;67;55;49;35;155;51;0;284;9220368;(null);0;0;0;0;0;0;0;0;0;0
200;sewer orc;You see an ugly orc running towards you with a dagger.;Grunt!;200;orc;;;-1;3;1;0;0;2;-50;18;13;12;8;12;25;25;0;0;70;17;35;10;2;3;0;0;0;0;0;0;0;1024;0;0;0;0;0;0;0;0;0;0;0;0;0;0;0;0;0;0;0;0;0;0;0;0;7;8;9;0;0;0;0;0;0;0;0;0;0;0;0;0;0;0;0;0;0;0;0;0;0;0;0;0;0;0;0;0;0;371;0;371;0;371;0;371;0;0;370;0;0;16940080;(null);0;0;0;0;0;0;0;0;0;0
201;gypsy-bard;You see an attractive woman playing a musical instrument and dancing around.;Come dance with me;201;bard;;;-1;1;1;0;0;3;40;12;10;12;13;12;9;9;0;0;90;20;8;5;1;4;0;0;0;0;0;0;0;1024;0;0;0;0;0;0;0;0;0;0;0;0;0;0;0;0;0;0;0;0;0;0;0;0;0;0;0;0;0;0;0;0;0;0;0;0;0;0;0;0;0;0;0;0;0;0;0;0;0;0;0;0;0;0;0;0;0;418;244;245;245;245;246;244;246;379;244;0;244;16943280;(null);0;0;0;0;0;0;0;0;0;0
202;herald;You see one of Lord Mandrake's heralds, probably delivering news.;Please do not delay me, m'lord.  I am in haste to get to the castle.;202;;;;-1;2;1;0;0;0;25;13;15;12;12;12;10;10;0;0;80;19;10;20;1;6;0;0;0;0;0;0;0;1024;0;0;0;0;0;0;0;0;0;0;0;0;0;0;0;0;0;0;0;0;0;0;0;0;11;13;0;0;0;0;0;0;0;0;0;0;0;0;0;0;0;0;0;0;0;0;0;0;0;0;0;0;0;0;0;0;0;246;246;202;14;15;16;17;18;19;1;0;246;16946480;(null);0;0;0;0;0;0;0;0;0;0
203;blade;You see an experienced bard trained in the field of killing.;Give me your gold and I might spare your life, if I'm in a good mood.;203;;;;-1;2;1;0;0;0;-25;13;15;10;10;10;18;18;0;0;70;18;15;10;2;3;0;0;0;0;0;0;0;1024;0;0;0;0;0;0;0;0;0;0;0;0;0;0;0;0;0;0;0;0;0;0;0;0;7;11;13;0;0;0;0;0;0;0;0;0;0;0;0;0;0;0;0;0;0;0;0;0;0;0;0;0;0;0;0;0;0;248;248;247;247;248;248;247;247;248;247;0;248;16949680;(null);0;0;0;0;0;0;0;0;0;0
204;skald;You see a large Viking-type warrior just off from a recent raid.;You dare to insult me by talking to me?;204;;;;-1;3;1;0;0;0;0;18;10;13;12;10;30;30;0;0;70;17;35;20;2;3;1;0;0;0;0;0;0;1024;0;0;0;0;0;0;0;0;0;0;0;0;0;0;0;0;0;0;0;0;0;0;0;0;13;0;0;0;0;0;0;0;0;0;0;0;0;0;0;0;0;0;0;0;0;0;0;0;0;0;0;0;0;0;0;0;0;0;0;0;0;0;0;0;0;0;0;0;0;16952880;(null);0;0;0;0;0;0;0;0;0;0
205;jongleur;You see a rogue juggling swords and dagger, trying to impress people.;I can juggle anything you give me.;205;;;;-1;1;1;0;0;0;25;12;18;10;10;12;10;10;0;0;90;18;10;0;1;4;0;0;0;0;0;0;0;1024;0;0;0;0;0;0;0;0;0;0;0;0;0;0;0;0;0;0;0;0;0;0;0;0;13;0;0;0;0;0;0;0;0;0;0;0;0;0;0;0;0;0;0;0;0;0;0;0;0;0;0;0;0;0;0;0;0;36;36;379;245;379;0;379;379;0;0;0;36;16956080;(null);0;0;0;0;0;0;0;0;0;0
206;meistersinger;You see a singer of tales and mighty epics.;I will sing you a story of two princes, Ragnar and Rutger, and a dead king.;206;;;;-1;2;1;0;0;0;25;12;18;10;16;12;15;15;0;0;80;19;15;0;1;6;0;0;0;0;0;0;0;1024;0;0;0;0;0;0;0;0;0;0;0;0;0;0;0;0;0;0;0;0;0;0;0;0;13;0;0;0;0;0;0;0;0;0;0;0;0;0;0;0;0;0;0;0;0;0;0;0;0;0;0;0;0;0;0;0;0;0;0;0;0;0;0;0;0;0;0;0;0;16959280;(null);0;0;0;0;0;0;0;0;0;0
207;tracker;You see an experienced ranger looking at some tracks on the ground.;If you'll excuse me, I am looking for someone.;207;;;;-1;4;1;0;0;0;30;16;17;10;12;10;35;35;0;0;60;16;40;5;2;3;2;0;0;0;0;0;0;1024;0;0;0;0;0;0;0;0;0;0;0;0;0;0;0;0;0;0;0;0;0;0;0;0;13;0;0;0;0;0;0;0;0;0;0;0;0;0;0;0;0;0;0;0;0;0;0;0;0;0;0;0;0;0;0;0;0;51;260;260;260;261;43;117;116;115;113;0;260;16962480;(null);0;0;0;0;0;0;0;0;0;0
208;traveler;You see a traveler who is a long way from home.;hey, this place is great...  I've never been here before;208;;;;-1;2;1;0;0;2;50;15;18;10;13;12;19;19;0;0;80;18;15;10;2;3;0;0;0;0;0;0;0;1024;0;0;0;0;0;0;0;0;0;0;0;0;0;0;0;0;0;0;0;0;0;0;0;0;13;0;0;0;0;0;0;0;0;0;0;0;0;0;0;0;0;0;0;0;0;0;0;0;0;0;0;0;0;0;0;0;0;260;371;202;23;31;32;33;60;62;65;0;371;16965680;(null);0;0;0;0;0;0;0;0;0;0
209;barmaid;You see a beautiful woman taking orders and serving drinks.;What'll ya have?  Special today's on dwarven ale.  Have a mug.;209;;;;-1;1;1;0;0;2;50;12;18;10;9;12;9;9;0;0;100;20;5;10;1;4;0;0;0;0;0;0;0;1024;0;0;0;0;0;0;0;0;0;0;0;0;0;0;0;0;0;0;0;0;0;0;0;0;0;0;0;0;0;0;0;0;0;0;0;0;0;0;0;0;0;0;0;0;0;0;0;0;0;0;0;0;0;0;0;0;0;0;0;0;0;0;0;0;0;0;0;0;0;16968880;(null);0;0;0;0;0;0;0;0;0;0
210;dwarven outcast;You see a dejected dwarf that's been ostricized by his society.;Leave me alone...I'm rather upset right now.;210;outcast;;;-1;5;1;0;0;0;50;18;15;10;12;12;50;50;0;0;30;18;70;10;2;5;0;0;0;0;0;0;0;1024;0;0;0;0;0;0;0;0;0;0;0;0;0;0;0;0;0;0;0;0;0;0;0;0;13;0;0;0;0;0;0;0;0;0;0;0;0;0;0;0;0;0;0;0;0;0;0;0;0;0;0;0;0;0;0;0;0;0;0;0;0;0;0;0;0;0;0;0;0;16972080;(null);0;0;0;0;0;0;0;0;0;0
211;dwarven miner;You see a short fellow with a miner's pick.;There's gold in the hills to the west!;211;miner;;;-1;4;1;0;0;2;50;18;15;10;13;10;45;45;0;0;65;17;50;10;2;3;2;0;0;0;0;0;0;1024;0;0;0;0;0;0;0;0;0;0;0;0;0;0;0;0;0;0;0;0;0;0;0;0;13;0;0;0;0;0;0;0;0;0;0;0;0;0;0;0;0;0;0;0;0;0;0;0;0;0;0;0;0;0;0;0;0;0;0;0;0;0;0;0;0;0;0;0;0;16975280;(null);0;0;0;0;0;0;0;0;0;0
212;red knight;You see an elite elven knight of the Order of the Rose.;four buttons must be used seven times in combination to lower the drawbridge;212;knight;;;-1;8;1;4;0;0;80;18;18;16;12;10;105;105;0;0;0;14;225;0;2;6;3;0;0;0;0;0;0;1024;0;0;0;0;0;0;0;0;0;0;0;0;0;0;0;0;0;0;0;0;0;0;0;0;8;9;13;41;0;0;0;0;0;0;0;0;0;0;0;0;0;0;0;0;0;0;0;0;0;0;0;0;0;0;0;0;0;255;255;255;43;102;251;250;252;251;250;0;255;16978480;(null);0;0;0;0;0;0;0;0;0;0
213;grey knight;You see a supurb knight of the Order of the Sword.;Read the papyras scroll in the library for information on elven runes.;213;knight;;;-1;7;1;4;0;0;80;18;17;10;15;12;85;85;0;0;10;15;160;0;2;6;2;0;0;0;0;0;0;1024;0;0;0;0;0;0;0;0;0;0;0;0;0;0;0;0;0;0;0;0;0;0;0;0;8;9;13;41;0;0;0;0;0;0;0;0;0;0;0;0;0;0;0;0;0;0;0;0;0;0;0;0;0;0;0;0;0;250;251;252;252;255;255;255;251;252;250;0;251;16981680;(null);0;0;0;0;0;0;0;0;0;0
214;white knight;You see a powerful knight from the Order of the Crown;The drawbridge opens only with the proper combination of buttons pressed.;214;knight;;;-1;6;1;4;0;2;90;18;12;10;13;10;65;65;0;0;30;16;120;0;2;4;2;0;0;0;0;0;0;1024;0;0;0;0;0;0;0;0;0;0;0;0;0;0;0;0;0;0;0;0;0;0;0;0;8;9;13;0;0;0;0;0;0;0;0;0;0;0;0;0;0;0;0;0;0;0;0;0;0;0;0;0;0;0;0;0;0;251;252;253;252;254;254;92;253;186;250;0;252;16984880;(null);0;0;0;0;0;0;0;0;0;0
215;archer;You see a skilled elven archer with his trusty bow.;What do you want?;215;;;;-1;5;1;4;0;2;50;18;13;10;15;12;60;60;0;0;50;15;100;0;3;3;1;0;0;0;0;0;0;1024;0;0;0;0;0;0;0;0;0;0;0;0;0;0;0;0;0;0;0;0;0;0;0;0;13;0;0;0;0;0;0;0;0;0;0;0;0;0;0;0;0;0;0;0;0;0;0;0;0;0;0;0;0;0;0;0;0;0;0;0;0;0;0;0;0;0;0;0;0;16988080;(null);0;0;0;0;0;0;0;0;0;0
216;marksman archer;You see an expert archer practicing her accuracy.;Please be quiet when I'm practicing.;216;archer;;;-1;7;1;0;0;0;50;18;18;10;12;10;80;80;0;0;30;13;180;0;2;6;2;0;0;0;0;0;0;1024;0;0;0;0;0;0;0;0;0;0;0;0;0;0;0;0;0;0;0;0;0;0;0;0;0;0;0;0;0;0;0;0;0;0;0;0;0;0;0;0;0;0;0;0;0;0;0;0;0;0;0;0;0;0;0;0;0;257;257;258;258;0;0;0;0;0;0;0;257;16991280;(null);0;0;0;0;0;0;0;0;0;0
217;sharpshooter archer;You see an elven archer that's so good, she seldom misses.;Give me a good bow and arrow and I'll clip a fly off your nose from 10 meters.;217;archer;;;-1;8;1;0;0;0;50;18;19;14;15;12;95;95;0;0;70;-5;230;0;3;4;2;0;0;0;0;0;0;1024;0;0;0;0;0;0;0;0;0;0;0;0;0;0;0;0;0;0;0;0;0;0;0;0;0;0;0;0;0;0;0;0;0;0;0;0;0;0;0;0;0;0;0;0;0;0;0;0;0;0;0;0;0;0;0;0;0;257;0;258;258;257;0;0;0;0;0;0;0;16994480;(null);0;0;0;0;0;0;0;0;0;0
218;alligator;You see a long, green lizard slithering towards you in the water.;;218;;;;-1;5;1;0;0;2;-25;20;20;3;3;3;60;60;0;0;10;18;90;0;3;3;0;0;0;0;0;0;0;1024;0;0;0;0;0;0;0;0;0;0;0;0;0;0;0;0;0;0;0;0;0;0;0;0;7;8;10;13;0;0;0;0;0;0;0;0;0;0;0;0;0;0;0;0;0;0;0;0;0;0;0;0;0;0;0;0;0;0;0;0;0;0;0;0;0;0;0;0;0;16997680;(null);0;0;0;0;0;0;0;0;0;0
219;crocodile;You see an ugly green lizard with a short snout slithering towards you.;;219;;;;-1;6;1;0;0;2;-50;22;20;16;3;3;70;70;0;0;10;17;140;0;4;3;0;0;0;0;0;0;0;1024;0;0;0;0;0;0;0;0;0;0;0;0;0;0;0;0;0;0;0;0;0;0;0;0;7;8;10;13;0;0;0;0;0;0;0;0;0;0;0;0;0;0;0;0;0;0;0;0;0;0;0;0;0;0;0;0;0;0;0;0;0;0;0;0;0;0;0;0;0;17000896;(null);0;0;0;0;0;0;0;0;0;0
220;elven dignitary;You see an elven dignitary from the City of Riverdell.;To solve any puzzle, you must first negate what's already been done.;220;dignitary;;;-1;5;1;0;0;0;25;13;18;9;15;10;55;55;0;0;60;15;80;10;2;4;1;0;0;0;0;0;0;1024;0;0;0;0;0;0;0;0;0;0;0;0;0;0;0;0;0;0;0;0;0;0;0;0;0;0;0;0;0;0;0;0;0;0;0;0;0;0;0;0;0;0;0;0;0;0;0;0;0;0;0;0;0;0;0;0;0;0;0;0;0;0;0;0;0;0;0;0;0;17004112;(null);0;0;0;0;0;0;0;0;0;0
221;dwarven dignitary;You see a dwarven dignitary no more than four feet high.;Consider the combination to the drawbridge to be two sets of three buttons.;221;dignitary;;;-1;5;1;0;0;0;25;18;12;12;15;10;60;60;0;0;50;17;80;10;3;3;0;0;0;0;0;0;0;1024;0;0;0;0;0;0;0;0;0;0;0;0;0;0;0;0;0;0;0;0;0;0;0;0;13;0;0;0;0;0;0;0;0;0;0;0;0;0;0;0;0;0;0;0;0;0;0;0;0;0;0;0;0;0;0;0;0;0;0;0;0;0;0;0;0;0;0;0;0;17007328;(null);0;0;0;0;0;0;0;0;0;0
222;human dignitary;You see a mannish person standing taller than most other people around him.;Not only dragons breathe fire.  Some mages and clerics have mastered it.;222;;;;-1;5;1;0;0;0;25;17;14;1;14;10;60;60;0;0;50;16;75;10;3;3;0;0;0;0;0;0;0;1024;0;0;0;0;0;0;0;0;0;0;0;0;0;0;0;0;0;0;0;0;0;0;0;0;13;0;0;0;0;0;0;0;0;0;0;0;0;0;0;0;0;0;0;0;0;0;0;0;0;0;0;0;0;0;0;0;0;0;0;0;0;0;0;0;0;0;0;0;0;17010544;(null);0;0;0;0;0;0;0;0;0;0
223;Izitara;You see Izitara, the high priestess of Kista.  ;Use wisdom to guide your life.  Don't waste your time with the gods.;223;izitara;priestess;;-1;15;1;3;0;0;100;18;21;20;18;18;210;210;100;100;-5;7;900;1000;7;4;2;0;0;0;0;0;0;1024;0;0;0;0;0;0;0;0;0;0;0;0;0;0;0;0;0;0;0;0;0;0;0;0;6;8;18;20;0;0;0;0;0;0;0;0;0;0;0;0;0;0;0;0;0;0;0;0;0;0;0;0;0;0;0;0;0;131;131;131;131;131;131;131;131;131;131;0;131;17013760;(null);0;0;0;0;0;0;0;0;0;0
224;Lyrion;You see Lyrion, Kista's premire alchemist.  ;what can I mix up for you?  A potion of some sort?;224;lyrion;;;-1;15;1;5;0;0;75;20;20;20;20;20;200;200;300;300;10;8;950;100;6;4;4;0;0;0;0;0;0;1024;0;0;0;0;0;0;0;0;0;0;0;0;0;0;0;0;0;0;0;0;0;0;0;0;6;8;13;18;0;0;0;0;0;0;0;0;0;0;0;0;0;0;0;0;0;0;0;0;0;0;0;0;0;0;0;0;0;734;734;734;734;194;194;249;249;249;269;0;734;17016976;(null);0;0;0;0;0;0;0;0;0;0
225;heifer;You see a small, young female cow grazing in the grass.;Mooo.;225;;;;-1;1;1;0;0;2;10;18;5;5;5;5;8;8;0;0;90;20;5;0;1;4;0;0;0;0;0;0;0;1024;0;0;0;0;0;0;0;0;0;0;0;0;0;0;0;0;0;0;0;0;0;0;0;0;0;0;0;0;0;0;0;0;0;0;0;0;0;0;0;0;0;0;0;0;0;0;0;0;0;0;0;0;0;0;0;0;0;278;278;278;278;278;278;278;278;278;278;0;278;17020192;(null);0;0;0;0;0;0;0;0;0;0
226;dairy cow;You see a large cow grazing in the fields.;Mooo.;226;cow;;;-1;1;1;0;0;0;10;18;6;6;6;6;9;9;0;0;80;20;5;0;1;4;0;0;0;0;0;0;0;1024;0;0;0;0;0;0;0;0;0;0;0;0;0;0;0;0;0;0;0;0;0;0;0;0;0;0;0;0;0;0;0;0;0;0;0;0;0;0;0;0;0;0;0;0;0;0;0;0;0;0;0;0;0;0;0;0;0;278;278;278;278;278;278;278;278;278;278;0;278;17023408;(null);0;0;0;0;0;0;0;0;0;0
227;bull;You see a raging bull that doesn't like you messing with his cows.;<snort>;227;;;;-1;1;1;0;0;0;10;20;10;5;5;5;10;10;0;0;80;19;10;0;1;4;0;0;0;0;0;0;0;1024;0;0;0;0;0;0;0;0;0;0;0;0;0;0;0;0;0;0;0;0;0;0;0;0;7;10;13;0;0;0;0;0;0;0;0;0;0;0;0;0;0;0;0;0;0;0;0;0;0;0;0;0;0;0;0;0;0;0;0;0;0;0;0;0;0;0;0;0;0;17026624;(null);0;0;0;0;0;0;0;0;0;0
228;royal steed;You see a magnificent steed of pure white with a royal seal on his saddle.;;228;steed;;;-1;2;1;0;0;0;20;20;10;5;5;5;13;13;0;0;80;19;10;0;1;6;0;0;0;0;0;0;0;1024;0;0;0;0;0;0;0;0;0;0;0;0;0;0;0;0;0;0;0;0;0;0;0;0;10;13;0;0;0;0;0;0;0;0;0;0;0;0;0;0;0;0;0;0;0;0;0;0;0;0;0;0;0;0;0;0;0;0;0;0;0;0;0;0;0;0;0;0;0;17029840;(null);0;0;0;0;0;0;0;0;0;0
229;traveling horse;You see a poorly treated horse that looks like he hasn't rested in days.;;229;horse;;;-1;1;1;0;0;0;10;13;10;5;5;5;6;6;0;0;80;20;5;0;1;4;0;0;0;0;0;0;0;1024;0;0;0;0;0;0;0;0;0;0;0;0;0;0;0;0;0;0;0;0;0;0;0;0;13;0;0;0;0;0;0;0;0;0;0;0;0;0;0;0;0;0;0;0;0;0;0;0;0;0;0;0;0;0;0;0;0;0;0;0;0;0;0;0;0;0;0;0;0;17033056;(null);0;0;0;0;0;0;0;0;0;0
230;stablehand;You see a young stablehand tending to the various steeds in the stables.;Can I interest you in a horse for your travels?;230;hand;;;-1;1;1;0;0;0;10;13;12;10;8;11;10;10;0;0;100;19;7;10;1;4;1;0;0;0;0;0;0;1024;0;0;0;0;0;0;0;0;0;0;0;0;0;0;0;0;0;0;0;0;0;0;0;0;13;0;0;0;0;0;0;0;0;0;0;0;0;0;0;0;0;0;0;0;0;0;0;0;0;0;0;0;0;0;0;0;0;0;0;0;0;0;0;0;0;0;0;0;0;17036272;(null);0;0;0;0;0;0;0;0;0;0
231;crypt guardian;You see a giant ghost-like monster guarding the Vault.;You will not succeed unless you are worty to claim my treasure.;231;guardian;;;-1;15;1;5;0;0;100;20;20;20;20;15;200;200;250;250;0;5;1000;100;6;4;6;0;0;0;0;0;0;1024;0;0;0;0;0;0;0;0;0;0;0;0;0;0;0;0;0;0;0;0;0;0;0;0;8;9;13;15;16;18;22;23;0;0;0;0;0;0;0;0;0;0;0;0;0;0;0;0;0;0;0;0;0;0;0;0;0;80;78;74;91;137;249;249;249;249;249;0;78;17039488;(null);0;0;0;0;0;0;0;0;0;0
232;the Adamantine Dragon;You see a large dragon whose scales appear to be adamantine.;take the key to the Hanging Gardens, but remember, you can only take it once.;232;adamantine;dragon;elise;-1;25;1;5;0;0;250;25;25;25;25;25;425;425;1000;1000;-50;-5;3500;3000;6;6;0;0;0;0;0;0;0;1024;0;0;0;0;0;0;0;0;0;0;0;0;0;0;0;0;0;0;0;0;0;0;0;0;6;18;20;21;24;28;0;0;0;0;0;0;0;0;0;0;0;0;0;0;0;0;0;0;0;0;0;0;0;0;0;0;0;0;0;0;0;0;0;0;0;0;0;0;0;17042704;(null);0;0;0;0;0;0;0;0;0;0
233;Lord Aaileman;You see the great Lord Aaileman, ruler of the Towers of Kista.;What is it you seek, friend?  Seek Elise in the west tower;233;lord;aaileman;;-1;16;1;0;0;0;100;22;21;20;21;21;220;220;0;0;-30;4;1100;1200;4;8;0;0;0;0;0;0;0;1024;0;0;0;0;0;0;0;0;0;0;0;0;0;0;0;0;0;0;0;0;0;0;0;0;6;10;13;24;0;0;0;0;0;0;0;0;0;0;0;0;0;0;0;0;0;0;0;0;0;0;0;0;0;0;0;0;0;733;733;733;733;733;733;733;733;733;733;0;733;17045920;(null);0;0;0;0;0;0;0;0;0;0
234;Lady Drianna;You see the beautiful Lady Drianna, wife of Lord Aaileman.;if you come seeking something, you should also seek my husband.;234;lady;drianna;;-1;15;1;0;0;0;100;18;21;20;22;20;205;205;0;0;-20;5;900;1000;4;8;1;0;0;0;0;0;0;1024;0;0;0;0;0;0;0;0;0;0;0;0;0;0;0;0;0;0;0;0;0;0;0;0;1;6;10;0;0;0;0;0;0;0;0;0;0;0;0;0;0;0;0;0;0;0;0;0;0;0;0;0;0;0;0;0;0;733;733;733;733;733;733;733;733;733;733;0;733;17049136;(null);0;0;0;0;0;0;0;0;0;0
235;Illia;You see Illia, the elven dignitary from Riverdell, working at her desk.;I will not answer questions now.  I must prepare for my speech.;235;illia;;;-1;8;1;0;0;0;25;18;16;10;15;16;100;100;0;0;30;12;210;50;4;4;0;0;0;0;0;0;0;1024;0;0;0;0;0;0;0;0;0;0;0;0;0;0;0;0;0;0;0;0;0;0;0;0;6;10;0;0;0;0;0;0;0;0;0;0;0;0;0;0;0;0;0;0;0;0;0;0;0;0;0;0;0;0;0;0;0;281;281;257;258;266;257;258;266;281;115;0;281;17052352;(null);0;0;0;0;0;0;0;0;0;0
236;Drowlin;You see Drowlin, a rough-looking dwarf from the mountains.;Be gone!  I have no time to talk to peasants such as yourselves.;236;drowlin;;;-1;8;1;0;0;0;25;20;16;15;15;12;100;100;0;0;20;12;200;200;3;5;0;0;0;0;0;0;0;1024;0;0;0;0;0;0;0;0;0;0;0;0;0;0;0;0;0;0;0;0;0;0;0;0;6;10;13;0;0;0;0;0;0;0;0;0;0;0;0;0;0;0;0;0;0;0;0;0;0;0;0;0;0;0;0;0;0;45;102;282;250;229;45;102;282;250;229;0;102;17055568;(null);0;0;0;0;0;0;0;0;0;0
237;hobbit;You see a short person wandering around, looking lost.;Pardon me, but could you show me the way back to the Shire?;237;;;;-1;1;1;0;0;3;50;16;18;10;15;10;8;8;0;0;90;19;7;2;1;4;0;0;0;0;0;0;0;1024;0;0;0;0;0;0;0;0;0;0;0;0;0;0;0;0;0;0;0;0;0;0;0;0;11;13;0;0;0;0;0;0;0;0;0;0;0;0;0;0;0;0;0;0;0;0;0;0;0;0;0;0;0;0;0;0;0;0;0;0;0;0;0;0;0;0;0;0;0;17058784;(null);0;0;0;0;0;0;0;0;0;0
238;pony;You see a small, horse-like animal carrying supplies.;;238;;;;-1;1;1;0;0;3;25;20;16;10;6;12;10;10;0;0;90;20;8;0;1;4;1;0;0;0;0;0;0;1024;0;0;0;0;0;0;0;0;0;0;0;0;0;0;0;0;0;0;0;0;0;0;0;0;11;13;0;0;0;0;0;0;0;0;0;0;0;0;0;0;0;0;0;0;0;0;0;0;0;0;0;0;0;0;0;0;0;0;0;0;0;0;0;0;0;0;0;0;0;17062000;(null);0;0;0;0;0;0;0;0;0;0
239;yellow dragon;You see a young, pure-breed yellow dragon, a very endangered species.;I may be small but I can take you on!;239;dragon;;;-1;13;1;0;0;0;-50;23;20;13;22;6;135;135;135;135;-20;8;700;100;3;6;3;0;0;0;0;0;0;1024;0;0;0;0;0;0;0;0;0;0;0;0;0;0;0;0;0;0;0;0;0;0;0;0;7;8;9;13;18;20;22;0;0;0;0;0;0;0;0;0;0;0;0;0;0;0;0;0;0;0;0;0;0;0;0;0;0;387;418;375;384;383;382;353;407;284;199;0;418;17065216;(null);0;0;0;0;0;0;0;0;0;0
240;cyan dragon;You see a light blue dragon, which is a crossbreed of blue and white dragons.;I'm having a very bad day.;240;dragon;;;-1;15;1;0;0;0;-50;24;20;13;22;15;155;155;155;155;-25;7;1000;150;6;3;4;0;0;0;0;0;0;1024;0;0;0;0;0;0;0;0;0;0;0;0;0;0;0;0;0;0;0;0;0;0;0;0;7;8;9;13;18;20;22;0;0;0;0;0;0;0;0;0;0;0;0;0;0;0;0;0;0;0;0;0;0;0;0;0;0;387;386;385;383;376;199;368;199;155;55;0;386;17068432;(null);0;0;0;0;0;0;0;0;0;0
241;orange dragon;You see a young orange dragon with a bright orange stripe down it's mane.;;241;dragon;;;-1;0;1;0;0;0;0;0;0;0;0;0;0;0;0;0;0;0;0;0;0;0;0;0;0;0;0;0;0;1024;0;0;0;0;0;0;0;0;0;0;0;0;0;0;0;0;0;0;0;0;0;0;0;0;0;0;0;0;0;0;0;0;0;0;0;0;0;0;0;0;0;0;0;0;0;0;0;0;0;0;0;0;0;0;0;0;0;0;0;0;0;0;0;0;0;0;0;0;0;17071648;(null);0;0;0;0;0;0;0;0;0;0
242;gladiator;You see a muscular gladiator that looks like he'd like to tear your head off.;I'm going to rip your head off!;242;gladiator;;;-1;6;1;4;0;0;-5;18;15;10;12;4;65;65;0;0;40;15;120;0;2;4;2;0;0;0;0;0;0;1024;0;0;0;0;0;0;0;0;0;0;0;0;0;0;0;0;0;0;0;0;0;0;0;0;7;8;9;13;0;0;0;0;0;0;0;0;0;0;0;0;0;0;0;0;0;0;0;0;0;0;0;0;0;0;0;0;0;304;305;418;27;28;29;57;66;118;213;0;305;17074864;(null);0;0;0;0;0;0;0;0;0;0
243;dancing girl;You see a beautiful dancing girl displaying herself on stage.;Please...I'm not that kind of a girl!;243;girl;;;-1;1;1;0;0;2;25;13;15;10;8;9;7;7;0;0;100;20;10;0;1;4;1;0;0;0;0;0;0;1024;0;0;0;0;0;0;0;0;0;0;0;0;0;0;0;0;0;0;0;0;0;0;0;0;0;0;0;0;0;0;0;0;0;0;0;0;0;0;0;0;0;0;0;0;0;0;0;0;0;0;0;0;0;0;0;0;0;0;0;0;0;0;0;0;0;0;0;0;0;17078080;(null);0;0;0;0;0;0;0;0;0;0
244;the Mayor Millwood;You see a grotesquely deformed skeleton sitting in the Mayor's chair.;Life...Don't talk to me about Life!;244;mayor;millwood;Millwood;-1;16;1;5;0;0;-25;21;18;18;25;10;200;200;70;70;0;5;1100;150;4;6;3;0;0;0;0;0;0;1024;0;0;0;0;0;0;0;0;7;12;13;14;15;19;20;0;0;0;0;0;0;0;0;0;6;8;9;13;15;16;18;23;28;0;0;0;0;0;0;0;0;0;0;0;0;0;0;0;0;0;0;0;0;0;0;0;0;503;503;503;165;165;199;199;270;375;375;0;503;17081296;(null);0;0;0;0;0;0;0;0;0;0
245;scarecrow;You see a straw-stuffed man walking towards you.;You wouldn't happen to have a spare brain, would you?;245;;;;-1;1;1;0;0;0;0;12;13;10;5;10;8;8;0;0;100;20;5;2;1;4;0;0;0;0;0;0;0;1024;0;0;0;0;0;0;0;0;0;0;0;0;0;0;0;0;0;0;0;0;0;0;0;0;13;0;0;0;0;0;0;0;0;0;0;0;0;0;0;0;0;0;0;0;0;0;0;0;0;0;0;0;0;0;0;0;0;4;7;8;9;10;11;13;12;6;5;0;7;17084512;(null);0;0;0;0;0;0;0;0;0;0
246;half-giant gladiator;You see a rather large gladiator waiting to face off with you.;I break you in two, you puny girly-man!;246;giant;gladiator;;-1;9;1;0;0;0;0;24;16;20;5;8;120;120;0;0;10;11;325;150;3;5;2;0;0;0;0;0;0;1024;0;0;0;0;0;0;0;0;0;0;0;0;0;0;0;0;0;0;0;0;0;0;0;0;9;13;0;0;0;0;0;0;0;0;0;0;0;0;0;0;0;0;0;0;0;0;0;0;0;0;0;0;0;0;0;0;0;25;45;91;227;316;253;223;158;210;223;0;45;17087728;(null);0;0;0;0;0;0;0;0;0;0
247;human gladiator;You see a tall, muscular human gladiator waiting to tear you apart.;Ugh!  You talking to me?;247;gladiator;;;-1;7;1;0;0;0;0;20;18;16;5;5;80;80;0;0;50;13;180;100;4;3;2;0;0;0;0;0;0;1024;0;0;0;0;0;0;0;0;0;0;0;0;0;0;0;0;0;0;0;0;0;0;0;0;13;0;0;0;0;0;0;0;0;0;0;0;0;0;0;0;0;0;0;0;0;0;0;0;0;0;0;0;0;0;0;0;0;51;51;54;55;58;60;78;79;70;92;0;51;17090944;(null);0;0;0;0;0;0;0;0;0;0
248;mul gladiator;You see a mul gladiator, a crossbreed of a human and a dwarf.;What did you say about my parents?;248;gladiator;;;-1;7;1;0;0;0;0;21;20;16;9;5;90;90;0;0;30;13;200;10;4;3;3;0;0;0;0;0;0;1024;0;0;0;0;0;0;0;0;0;0;0;0;0;0;0;0;0;0;0;0;0;0;0;0;7;8;13;0;0;0;0;0;0;0;0;0;0;0;0;0;0;0;0;0;0;0;0;0;0;0;0;0;0;0;0;0;0;45;34;51;51;57;57;83;91;97;79;0;34;17094160;(null);0;0;0;0;0;0;0;0;0;0
249;blue flying snake;You see a flying snake coming towards you, fangs bared.;Hisssssss.;249;flying ;snake;;-1;5;1;0;0;2;-25;14;20;10;10;10;50;50;0;0;50;15;70;10;2;3;1;0;0;0;0;0;0;1024;0;0;0;0;0;0;0;0;0;0;0;0;0;0;0;0;0;0;0;0;0;0;0;0;7;10;13;14;0;0;0;0;0;0;0;0;0;0;0;0;0;0;0;0;0;0;0;0;0;0;0;0;0;0;0;0;0;47;53;55;55;119;113;192;213;287;315;0;53;17097376;(null);0;0;0;0;0;0;0;0;0;0
250;green flying snake;You see a green-colored flying snake slithering its way towards you.;Hisssssss.;250;green;flying;snake;-1;6;1;0;0;2;0;12;25;12;8;12;70;70;0;0;60;14;110;25;3;3;0;0;0;0;0;0;0;1024;0;0;0;0;0;0;0;0;0;0;0;0;0;0;0;0;0;0;0;0;0;0;0;0;7;10;13;14;0;0;0;0;0;0;0;0;0;0;0;0;0;0;0;0;0;0;0;0;0;0;0;0;0;0;0;0;0;33;34;318;321;322;323;324;325;309;310;0;34;17100592;(null);0;0;0;0;0;0;0;0;0;0
251;werewolf;You see a mean looking wolf-like creature growling at you.;Grrrrr.;251;;;;-1;5;1;0;0;0;-25;17;17;10;12;8;60;60;0;0;50;12;85;0;2;4;0;0;0;0;0;0;0;1024;0;0;0;0;0;0;0;0;0;0;0;0;0;0;0;0;0;0;0;0;0;0;0;0;7;8;10;13;14;0;0;0;0;0;0;0;0;0;0;0;0;0;0;0;0;0;0;0;0;0;0;0;0;0;0;0;0;36;37;47;35;80;48;36;53;51;67;0;37;17103808;(null);0;0;0;0;0;0;0;0;0;0
252;large werewolf;You see a very large, mature wolf that stands up like a man.;Growl!!;252;werewolf;;;-1;6;1;0;0;0;-50;18;15;18;10;8;75;75;0;0;30;10;140;20;3;4;0;0;0;0;0;0;0;1024;0;0;0;0;0;0;0;0;0;0;0;0;0;0;0;0;0;0;0;0;0;0;0;0;7;10;13;14;0;0;0;0;0;0;0;0;0;0;0;0;0;0;0;0;0;0;0;0;0;0;0;0;0;0;0;0;0;172;181;371;199;80;54;55;218;155;142;0;181;17107024;(null);0;0;0;0;0;0;0;0;0;0
253;greater werewolf;You see one of the largest werewolves you've ever seen!;Growl!!!;253;werewolf;wolf;;-1;7;1;0;0;0;-50;20;15;18;13;12;100;100;0;0;0;9;160;15;6;2;2;0;0;0;0;0;0;1024;0;0;0;0;0;0;0;0;0;0;0;0;0;0;0;0;0;0;0;0;0;0;0;0;7;8;10;13;14;0;0;0;0;0;0;0;0;0;0;0;0;0;0;0;0;0;0;0;0;0;0;0;0;0;0;0;0;206;184;153;165;83;95;107;172;181;199;0;184;17110240;(null);0;0;0;0;0;0;0;0;0;0
254;Countess Natasha de Allisk;You see the mysterious countess you've up until now only heard rumors about.;How dare you disturb my rest.  You will be destroyed!;254;countess;natasha;allisk;-1;20;1;5;0;0;-100;25;25;18;19;10;250;250;150;150;-10;0;1800;100;4;6;4;0;0;0;0;0;0;1024;0;0;0;0;0;0;0;0;0;0;0;0;0;0;0;0;0;0;0;0;0;0;0;0;6;7;8;9;14;15;18;22;23;28;31;35;0;0;0;0;0;0;0;0;0;0;0;0;0;0;0;0;0;0;0;0;0;375;376;184;146;206;174;112;114;377;199;0;376;17113456;(null);0;0;0;0;0;0;0;0;0;0
255;blue knight;You see a majestic blue knight, ready to challenge you in battle.;Be brave and be smart, and you will triumph.;255;knight;;;-1;4;1;0;0;0;50;17;12;14;12;10;43;43;0;0;60;16;55;0;2;4;0;0;0;0;0;0;0;1024;0;0;0;0;0;0;0;0;0;0;0;0;0;0;0;0;0;0;0;0;0;0;0;0;8;9;13;41;0;0;0;0;0;0;0;0;0;0;0;0;0;0;0;0;0;0;0;0;0;0;0;0;0;0;0;0;0;0;0;0;0;0;0;0;0;0;0;0;0;17116672;(null);0;0;0;0;0;0;0;0;0;0
256;green knight;You see a majestic green knight prepared to challenge you.;Be thee a worthy opponent and you shall be victorious.;256;knight;;;-1;5;1;4;0;0;50;16;12;12;12;14;50;50;0;0;50;15;85;50;1;8;2;0;0;0;0;0;0;1024;0;0;0;0;0;0;0;0;0;0;0;0;0;0;0;0;0;0;0;0;0;0;0;0;8;9;13;41;0;0;0;0;0;0;0;0;0;0;0;0;0;0;0;0;0;0;0;0;0;0;0;0;0;0;0;0;0;0;0;0;0;0;0;0;0;0;0;0;0;17119888;(null);0;0;0;0;0;0;0;0;0;0
257;red knight;You see a strong knight dressed in chain mail with a red banner.;Will you be worthy enough to challenge me?;257;knight;;;-1;6;1;4;0;0;50;20;10;13;15;13;70;70;0;0;40;14;120;100;2;5;2;0;0;0;0;0;0;1024;0;0;0;0;0;0;0;0;0;0;0;0;0;0;0;0;0;0;0;0;0;0;0;0;8;9;13;41;0;0;0;0;0;0;0;0;0;0;0;0;0;0;0;0;0;0;0;0;0;0;0;0;0;0;0;0;0;0;0;0;0;0;0;0;0;0;0;0;0;17123104;(null);0;0;0;0;0;0;0;0;0;0
258;barbarian;You see a large barbarian grunt that wouldn't mind tearing your head off.;You talking to me you puny man?;258;class;second;;-1;3;1;2;0;0;5;18;15;16;5;6;32;32;0;0;80;18;30;10;1;5;2;0;0;0;0;0;0;1024;0;0;0;0;0;0;0;0;0;0;0;0;0;0;0;0;0;0;0;0;0;0;0;0;8;9;13;0;0;0;0;0;0;0;0;0;0;0;0;0;0;0;0;0;0;0;0;0;0;0;0;0;0;0;0;0;0;0;0;0;0;0;0;0;0;0;0;0;0;17126320;(null);0;0;0;0;0;0;0;0;0;0
259;barbarian;You see a large grunt that wants to tear your head off.;Grrrrrrr.;259;class;first;;-1;4;1;2;0;0;5;20;15;15;3;11;40;40;0;0;70;17;50;15;1;6;2;0;0;0;0;0;0;1024;0;0;0;0;0;0;0;0;0;0;0;0;0;0;0;0;0;0;0;0;0;0;0;0;6;8;13;0;0;0;0;0;0;0;0;0;0;0;0;0;0;0;0;0;0;0;0;0;0;0;0;0;0;0;0;0;0;0;0;0;0;0;0;0;0;0;0;0;0;17129536;(null);0;0;0;0;0;0;0;0;0;0
260;tribesman;You see a large, grinning barbarian waiting to tear your head off.;Let's Rock!;260;;;;-1;4;1;2;0;0;5;20;16;10;13;12;45;45;0;0;60;16;60;15;2;4;0;0;0;0;0;0;0;1024;0;0;0;0;0;0;0;0;0;0;0;0;0;0;0;0;0;0;0;0;0;0;0;0;4;8;9;13;0;0;0;0;0;0;0;0;0;0;0;0;0;0;0;0;0;0;0;0;0;0;0;0;0;0;0;0;0;0;0;0;0;0;0;0;0;0;0;0;0;17132752;(null);0;0;0;0;0;0;0;0;0;0
261;grunt;You see a young, but very large barbarian in front of you.;What are you looking at?;261;;;;-1;2;1;2;0;2;10;20;13;10;6;8;24;24;0;0;80;18;14;0;3;2;0;0;0;0;0;0;0;1024;0;0;0;0;0;0;0;0;0;0;0;0;0;0;0;0;0;0;0;0;0;0;0;0;13;0;0;0;0;0;0;0;0;0;0;0;0;0;0;0;0;0;0;0;0;0;0;0;0;0;0;0;0;0;0;0;0;60;179;186;75;2;30;33;46;6;1;0;179;17135968;(null);0;0;0;0;0;0;0;0;0;0
262;grunt;You see a young barbarian who could use a sparing partner.;Let's Rock!;262;;;;-1;3;1;2;0;2;10;20;13;12;6;8;32;32;0;0;70;18;25;0;3;2;1;0;0;0;0;0;0;1024;0;0;0;0;0;0;0;0;0;0;0;0;0;0;0;0;0;0;0;0;0;0;0;0;13;0;0;0;0;0;0;0;0;0;0;0;0;0;0;0;0;0;0;0;0;0;0;0;0;0;0;0;0;0;0;0;0;326;327;26;29;30;31;32;33;34;38;0;327;17139184;(null);0;0;0;0;0;0;0;0;0;0
263;tribesman;You see a middle-aged barbarian warrior in his prime.;You talking to me?;263;;;;-1;5;1;2;0;2;5;22;16;14;5;10;56;56;0;0;50;15;90;5;2;4;2;0;0;0;0;0;0;1024;0;0;0;0;0;0;0;0;0;0;0;0;0;0;0;0;0;0;0;0;0;0;0;0;4;13;0;0;0;0;0;0;0;0;0;0;0;0;0;0;0;0;0;0;0;0;0;0;0;0;0;0;0;0;0;0;0;326;327;328;329;330;326;327;328;329;330;0;327;17142400;(null);0;0;0;0;0;0;0;0;0;0
